id,Page,Title,Price_Raw,Price_Billion,Price_per_m2,Area_m2,District,Address,Bedrooms,Toilets,Post_Time,Link,Description,Mặt tiền,Chiều sâu,Mức độ giao dịch,Ưu điểm BĐS,Số ban công,Hướng ban công,Tiện ích
306347404,1,"Cần tiền bán gấp nhà An Bình, Phường 2, Quận 5, giá 5,99 tỷ diện tích 39m2","5,99 tỷ",5.99,"153,59 triệu/m²",39,N/A,"Đ. An Bình, P. 2, Q. 5, Tp. Hồ Chí Minh",,,05/01/2026,https://meeyland.com/ban-nha-rieng-quan-5-ho-chi-minh-i1223/306347404,"Cần tiền bán gấp nhà An Bình, Phường 2, Quận 5, giá 5,99 tỷ diện tích 39m2 Diện tích: 3,9 x 10m. Giá bán: 5 tỷ 990. Thông tin nổi bật: Khu dân cư lâu năm, an ninh, sinh hoạt tiện. Hẻm sạch, xe ra vào thuận tiện. Nhà vuông vức, bố trí hợp lý, vào ở ngay. Pháp lý rõ ràng, công chứng nhanh. Tiện ích xung quanh: Gần chợ An Đông, chợ Kim Biên. Gần bệnh viện Chợ Rẫy, BV Đại học Y Dược. Gần trường học các cấp, trung tâm hành chính. Thuận tiện di chuyển sang Quận 1, Quận 10. Lợi thế đầu tư: Khu vực trung tâm Quận 5, nhu cầu thuê cao. Phù hợp cho thuê gia đình, phòng trọ cao cấp. Bất động sản Quận 5 luôn giữ giá và dễ thanh khoản. Chủ kẹt tiền cần bán gấp khách thiện chí chốt nhanh có giá tốt. Thu gọn Liên hệ: SĐT 1 090 443 **** Hiện số",,,,,,,
304968743,1,"Chính chủ bán gấp nhà Hồng Bàng, quận 5, giá 3,55 tỷ","3,55 tỷ",3.55,"55,47 triệu/m²",64,N/A,"Đ. Hồng Bàng, P. 10, Q. 5, Tp. Hồ Chí Minh",2,2,05/01/2026,https://meeyland.com/ban-nha-rieng-quan-5-ho-chi-minh-i1223/304968743,"Chính chủ bán gấp nhà Hồng Bàng, Quận 5. Giá 3,55 tỷ, DT 64m2, sang tên mua bán nhanh, hẻm xe hơi 6m Diện tích 64m2 (4x16) Kết cấu 1 trệt 1 lầu, 2pn, 3wc Khu dân cư đông đúc, kinh doanh buôn bán sầm uất, thuận tiện di chuyển qua các quận lân cận. Tiện ích xung quanh đầy đủ: chợ, siêu thị, trường học, bệnh viện, công viên,.. Nhà đang cho thuê 15 triệu/tháng. Thích hợp mua ở hoặc cho thuê. Gọi ngay Quỳnh Như xem nhà trực tiếp Thu gọn Liên hệ: SĐT 1 076 637 **** Hiện số Thông tin chi tiết Mặt tiền 6m Chiều sâu 10,67m Mức độ giao dịch Càng sớm càng tốt Ưu điểm BĐS Giao thông thuận lợi",6m,"10,67m",Càng sớm càng tốt,Giao thông thuận lợi,,,
305692543,1,Chủ kẹt tiền cần bán gấp nhà trung tâm quận 5,"4,8 tỷ",4.8,100 triệu/m²,48,N/A,"Đ. Trần Hưng Đạo, P. 14, Q. 5, Tp. Hồ Chí Minh",,,05/01/2026,https://meeyland.com/ban-nha-rieng-quan-5-ho-chi-minh-i1223/305692543,"Vị trí cực hiếm Khu không có nhà bán xe tải vào tận cửa sổ riêng sang tên ngay! Địa chỉ: Ngay đường Trần Hưng Đạo, Phường 14, Quận 5 sát trung tâm thương mại Đồng Khánh Chợ Lớn. Liền kề các tuyến đường lớn: Hòa Bình, Nguyễn Trãi, Hồng Bàng. Bao quanh là đầy đủ tiện ích: Chợ Hòa Bình, chợ An Đông, Đại Thế Giới, bệnh viện Nguyễn Tri Phương, trường học, siêu thị. Hẻm 5m xe tải vào tận nhà Khu dân trí cao, cực kỳ yên tĩnh và an toàn. Chỉ vài bước ra mặt tiền hiếm có căn thứ 2 ở khu vực này! Diện tích: 4m x 12m vuông vức đẹp, không lỗi phong thuỷ. Kết cấu: 1 trệt + 1 lửng + 3 lầu + sân thượng. Công năng đầy đủ: Sân để xe, phòng khách, bếp. 3 phòng ngủ Master có vệ sinh riêng. Phòng sinh hoạt chung, phòng thờ, sân thượng rộng rãi. Pháp lý: Sổ hồng riêng chính chủ Hoàn công đủ Công chứng trong ngày! Giá 3 tỷ 800 thỏa thuận thương lượng nhanh cho người thiện chí. Chủ nhà đang kẹt tiền cần bán gấp giá đã rẻ hơn thị trường gần 500 triệu! Liên hệ ngay để xem nhà trước khi bị chốt mất! Không gửi sổ - làm việc rõ ràng trực tiếp. Thu gọn Liên hệ: SĐT 1 090 671 **** Hiện số Thông tin chi tiết Mức độ giao dịch Càng sớm càng tốt Ưu điểm BĐS Giao thông thuận lợi",,,Càng sớm càng tốt,Giao thông thuận lợi,,,
303535973,1,"Bán nhà riêng tại đường Nguyễn Trãi, phường 2, quận 5, giá bán 3,88 tỷ","3,88 tỷ",3.88,"88,18 triệu/m²",44,N/A,"Đ. Nguyễn Trãi, P. 2, Q. 5, Tp. Hồ Chí Minh",4,4,04/01/2026,https://meeyland.com/ban-nha-rieng-quan-5-ho-chi-minh-i1223/303535973,"Nhanh tay sở hữu căn nhà riêng lý tưởng tại Đường Nguyễn Trãi, Phường 2, Quận 5, Hồ Chí Minh với những đặc điểm nổi bật sau: + Giá chỉ 3,88 tỷ VND. + Diện tích 44m², 4 tầng, 4PN, 4WC. + Nội thất cơ bản, tiện nghi. + Ngõ vào rộng 6m, thuận tiện cho ô tô di chuyển. + Mặt tiền 4m, thích hợp kinh doanh. + Pháp lý đầy đủ, sổ đỏ. Gần trường học, bệnh viện, siêu thị và công viên, thuận lợi cho cuộc sống hàng ngày. Thu gọn Liên hệ: SĐT 1 090 443 **** Hiện số Thông tin chi tiết Mức độ giao dịch Gấp",,,Gấp,,,,
305956515,1,"Kẹt tiền bán gấp nhà Nguyễn Trãi, phường 2, quận 5, giá bán 3,99 tỷ","3,99 tỷ",3.99,"66,5 triệu/m²",60,N/A,"Đ. Nguyễn Trãi, P. 2, Q. 5, Tp. Hồ Chí Minh",,,04/01/2026,https://meeyland.com/ban-nha-rieng-quan-5-ho-chi-minh-i1223/305956515,"Kẹt tiền bán gấp nhà Nguyễn Trãi, phường 2, quận 5, giá bán 3,99 tỷ Diện tích: 4 x 15m Giá: 3 tỷ 990 Liên hệ: 090443**** Hiện số - Quang Minh. • Nhà hẻm ô tô Nguyễn Trãi. • Kẹt tiền nên cần bán nhanh. • Khu trung tâm Quận 5. • Gần chợ, bệnh viện, trường học. • Thuận tiện kinh doanh hoặc cho thuê. • Sổ sách đầy đủ, công chứng nhanh. Liên hệ xem nhà ngay. Thu gọn Liên hệ: SĐT 1 090 443 **** Hiện số Thông tin chi tiết Mức độ giao dịch Gấp",,,Gấp,,,,
305927385,1,"Về quê bán gấp nhà riêng 40m2, 4,39 tỷ tại Trần Bình Trọng, phường 1, Quận 5","4,39 tỷ",4.39,"109,75 triệu/m²",40,N/A,"Đ. Trần Bình Trọng, P. 1, Q. 5, Tp. Hồ Chí Minh",,,04/01/2026,https://meeyland.com/ban-nha-rieng-quan-5-ho-chi-minh-i1223/305927385,"- Diện tích: 40m², giá chỉ 4,39 tỷ VND. - Mặt tiền rộng 4m, thuận lợi cho việc kinh doanh hoặc cho thuê. - Ngõ vào rộng 5m, dễ dàng di chuyển bằng xe hơi. - Pháp lý đầy đủ, đảm bảo an toàn cho giao dịch. Điểm đặc sắc: - Phong thủy tốt, mang lại tài lộc và sức khỏe cho gia chủ. - Khu vực an ninh, yên tĩnh, thích hợp cho cuộc sống gia đình. - Đường vào rộng rãi, dễ dàng tiếp cận. Gần các tiện ích như: - Bệnh viện Bệnh Nhiệt Đới, Bệnh viện Nguyễn Tri Phương, Bệnh viện Răng Hàm Mặt TP.HCM. - Công viên Hòa Bình, Công viên Âu Lạc, Công viên Khánh Hội. - Siêu thị Mẹ Bầu & Em Bé Con Cưng, WinMart+. - Trường Cao Đẳng Kinh Tế Đối Ngoại, Sylvan Learning Vietnam. Thu gọn Liên hệ: SĐT 1 090 443 **** Hiện số Thông tin chi tiết Mức độ giao dịch Gấp",,,Gấp,,,,
306007029,1,"Làm ăn bán gấp nhà Bùi Hữu Nghĩa, phường 7, quận 5, giá 4 tỷ 550","4,55 tỷ",4.55,"101,11 triệu/m²",45,N/A,"Đ. Bùi Hữu Nghĩa, P. 7, Q. 5, Tp. Hồ Chí Minh",,,04/01/2026,https://meeyland.com/ban-nha-rieng-quan-5-ho-chi-minh-i1223/306007029,"Làm ăn bán gấp nhà Bùi Hữu Nghĩa, phường 7, quận 5, giá 4 tỷ 550 Diện tích: 4,5 x 10m Giá: 4 tỷ 550 Liên hệ: 090443**** Hiện số • Vị trí trung tâm Quận 5, gần chợ và các tuyến đường lớn. • Hẻm sạch, khu dân cư lâu năm, hàng xóm thân thiện. • Di chuyển nhanh sang Quận 1 và Quận 10. • Diện tích gọn đẹp, thích hợp cho gia đình nhỏ hoặc làm văn phòng. • Khu vực kinh doanh sầm uất, phù hợp cho thuê ổn định. Liên hệ để xem nhà và thương lượng trực tiếp. Thu gọn Liên hệ: SĐT 1 090 443 **** Hiện số Thông tin chi tiết Mức độ giao dịch Gấp",,,Gấp,,,,
306304982,1,"Bán nhà 2 mặt tiền Võ Văn Kiệt, Quận 5, đẹp lung linh, ở hay cho thuê đều đỉnh","5,68 tỷ",5.68,"246,96 triệu/m²",23,N/A,"Đ. Võ Văn Kiệt, P. 5, Q. 5, Tp. Hồ Chí Minh",3,3,31/12/2025,https://meeyland.com/ban-nha-rieng-quan-5-ho-chi-minh-i1223/306304982,"Siêu phẩm nhà 2 mặt tiền mới đẹp lung linh tại đường Võ Văn Kiệt, Phường 5, Quận 5, TP. Hồ Chí Minh đây ạ! Nhà mình cách mặt tiền đường Võ Văn Kiệt chỉ 5m, vị trí siêu thuận tiện luôn nha. Diện tích công nhận 23m², đất thổ cư xịn sò, cực kỳ thích hợp để bạn an cư lạc nghiệp hoặc đầu tư cho thuê sinh lời cao đó. Kết cấu nhà gồm 3 tầng, có 3 phòng ngủ và 3 nhà vệ sinh, mỗi phòng đều có cửa sổ thoáng mát, đón gió trời tự nhiên. Giá yêu thương chỉ 5,680 tỷ đồng. Liên hệ ngay Zalo Trâm: 0906416071 để xem nhà và chốt deal nha! Thu gọn Liên hệ: SĐT 1 090 641 **** Hiện số Thông tin chi tiết Ưu điểm BĐS Cho thuê giá cao, Nhiều mặt thoáng",,,,"Cho thuê giá cao, Nhiều mặt thoáng",,,
306324127,1,"Bán nhà hẻm đường An Bình, phường 5, quận 5","6,3 tỷ",6.3,"215,75 triệu/m²",29.2,N/A,"Đ. An Bình, P. 5, Q. 5, Tp. Hồ Chí Minh",3,3,31/12/2025,https://meeyland.com/ban-nha-rieng-quan-5-ho-chi-minh-i1223/306324127,"Bán nhà hẻm đường An Bình, phường 5, quận 5 Diện tích: 3,2m x 10m Kết cấu: Trệt + 3 lầu. Nhà mới , dọn vào ở ngay. Vị trí : Hẻm 3m ,Từ mặt tiền vào nhà chỉ vài bước chân, thông thoáng, sạch sẽ, an ninh tuyệt đối. Phù hợp ở lâu dài – cho thuê – đầu tư giữ tiền Pháp lý: Sổ hồng chính chủ Giá: 6.3 Tỷ (Còn bớt). Zalo call: 0787.595.004 Mỹ Diện - Xem nhà ngay hôm nay! Thu gọn Liên hệ: SĐT 1 078 759 **** Hiện số Thông tin chi tiết Mặt tiền 3,2m Chiều sâu 10m Mức độ giao dịch Gấp Ưu điểm BĐS Giao thông thuận lợi","3,2m",10m,Gấp,Giao thông thuận lợi,,,
305969829,1,"Nhà 4 tầng An Dương Vương, Quận 5 - Kiến trúc mới đẹp, sổ vuông vắn","5,9 tỷ",5.9,59 triệu/m²,100,N/A,"Đ. An Dương Vương, P. 5, Q. 5, Tp. Hồ Chí Minh",3,,31/12/2025,https://meeyland.com/ban-nha-rieng-quan-5-ho-chi-minh-i1223/305969829,"Tọa lạc tại hẻm 4m An Dương Vương, Quận 5, Thành phố Hồ Chí Minh, căn nhà mới đẹp 4 tầng này là một kiệt tác kiến trúc hiện đại, mang đến không gian sống lý tưởng. Chỉ cách mặt tiền đường 15m, vị trí đắc địa này còn liền kề Đại học Sư phạm Quận 5, thuận tiện cho việc học tập và di chuyển. Với diện tích sàn lên đến 100m2, ngôi nhà sở hữu 4 tầng khang trang, bao gồm 3 phòng ngủ rộng rãi, đáp ứng mọi nhu cầu sinh hoạt của gia đình. Thiết kế tinh tế, nội thất cao cấp, mang đến sự sang trọng và tiện nghi. Giá chào bán nhỉnh 5 tỷ, chỉ 5.9 tỷ có thương lượng, một cơ hội hiếm có để sở hữu tổ ấm mơ ước tại trung tâm thành phố. Liên hệ P. Nam qua số điện thoại 0396092477 để biết thêm chi tiết và sắp xếp lịch xem nhà. Thu gọn Liên hệ: SĐT 1 039 609 **** Hiện số Thông tin chi tiết Mức độ giao dịch Càng sớm càng tốt Ưu điểm BĐS Giao thông thuận lợi, Vị trí trung tâm, Xây mới",,,Càng sớm càng tốt,"Giao thông thuận lợi, Vị trí trung tâm, Xây mới",,,
306054829,1,"Bán nhà 1 trệt 1 lửng 2 lầu, 5 phòng ngủ, hẻm 5m thông, Quận 5, giá 5.98 tỷ","5,98 tỷ",5.98,"209,82 triệu/m²",28.5,N/A,"Đ. Võ Trường Toản, P. 12, Q. 5, Tp. Hồ Chí Minh",5,5,30/12/2025,https://meeyland.com/ban-nha-rieng-quan-5-ho-chi-minh-i1223/306054829,"Nhà mới xây kiên cố, sẵn sàng đón chủ nhân mới tại vị trí đắc địa Quận 5. Tọa lạc tại hẻm 5m thông thoáng, xe hơi có thể di chuyển và đỗ ngay trước cửa nhà, mang lại sự tiện lợi tối đa. Với diện tích 3m x 9.5m, căn nhà được thiết kế khoa học gồm 1 trệt, 1 lửng, 2 lầu đúc bê tông cốt thép vững chắc. Cấu trúc nhà bao gồm 5 phòng ngủ và 3 nhà vệ sinh, phù hợp cho đại gia đình hoặc có thể tận dụng làm không gian kinh doanh, cho thuê. Ngôi nhà sở hữu hướng Chính Nam mát mẻ, đón gió tự nhiên và ánh sáng hài hòa. Vị trí đắc địa tại hẻm 1/ Võ Trường Toản, Phường 15 (nay là Phường Chợ Lớn mới), Quận 5, Thành phố Hồ Chí Minh, gần các tuyến đường lớn như Nguyễn Thị Nhỏ, thuận tiện di chuyển đến các khu vực trung tâm. Giá chào bán: 5 tỷ 980 triệu đồng (có thương lượng). Liên hệ: 0889775708 (Thúy) để biết thêm chi tiết và sắp xếp lịch xem nhà. Thu gọn Liên hệ: SĐT 1 088 977 **** Hiện số Thông tin chi tiết Mặt tiền 3m Chiều sâu 9,5m Ưu điểm BĐS Giao thông thuận lợi, Ô tô đỗ gần, Có tầng lửng + tum, Xây mới",3m,"9,5m",,"Giao thông thuận lợi, Ô tô đỗ gần, Có tầng lửng + tum, Xây mới",,,
306259824,1,"Bán căn hộ Nguyễn Trãi, phường 3, quận 5, 107m2, 7 tầng, thang máy, hệ thống phòng cháy đầy đủ","37,95 tỷ",37.95,"354,67 triệu/m²",107,N/A,"Đ. Nguyễn Trãi, P. 3, Q. 5, Tp. Hồ Chí Minh",30,30,30/12/2025,https://meeyland.com/ban-nha-rieng-quan-5-ho-chi-minh-i1223/306259824,"Bán căn hộ Nguyễn Trãi, phường 3, quận 5, 107m2, 7 tầng, thang máy, hệ thống phòng cháy đầy đủ. + Diện tích: 6,4m x 17m – CN 107m 2 + Kết cấu: 1 hầm + 6 tầng, 30 CHDV + MBKD. Có thang máy – PCCC đầy đủ + Đang cho thuê khoán 130tr/th. HĐ còn 5 năm, mỗi năm tăng 5%. Hàng hiếm dòng tiền – phù hợp đầu tư giữ tài sản + Vị trí trung tâm quận 5, đường Nguyễn Trãi sầm uất, thông An Dương Vương – Lê Hồng Phong + Sổ hồng riêng – hoàn công đầy đủ – pháp lý chuẩn + Giá: 37.x tỷ, thương lượng. Quý khách có nhu cầu, vui lòng gọi Tùng thổ cư. Để xem nhà, và được tư vấn miễm phí 24/7. Link tham khảo: https://nhatanbinhgiare.blogspot.com Phone, zalo: 0939927498. Chuyên nghiệp – Uy tín – Tận tình Thu gọn Liên hệ: SĐT 1 093 992 **** Hiện số Thông tin chi tiết Mặt tiền 6,4m Chiều sâu 17m Mức độ giao dịch Càng sớm càng tốt Ưu điểm BĐS Vị trí trung tâm","6,4m",17m,Càng sớm càng tốt,Vị trí trung tâm,,,
305993437,1,"Nhà Cách Mạng Tháng Tám, Quận 5 sát mặt tiền kinh doanh đỉnh, hẻm xe tải 8m, chỉ nhỉnh 11 tỷ",11 tỷ,11.0,"183,33 triệu/m²",60,N/A,"Q. 5, Tp. Hồ Chí Minh",5,5,30/12/2025,https://meeyland.com/ban-nha-rieng-quan-5-ho-chi-minh-i1223/305993437,"Bán nhà đường Cách Mạng Tháng Tám, Quận 5, vị trí sát mặt tiền kinh doanh đỉnh. Đường trước nhà rộng 8m, xe tải ra vào thoải mái, thông tứ tung, giao thông thuận tiện. Diện tích: 4m x 15m, vuông vắn, không lỗi phong thủy. Kết cấu nhà gồm 1 trệt, 1 lửng, 4 tầng bê tông cốt thép, có 5 phòng ngủ, 4 WC, phòng bếp, phòng khách đầy đủ công năng. Chủ nhà xây dựng tâm huyết, nhà mới, có thể vào ở ngay. Sổ hồng riêng, công chứng ngay. Giá nhỉnh 11 tỷ. Liên hệ ngay qua số điện thoại 0932081301 (Trung/Zalo) để biết thêm thông tin chi tiết và xem nhà. Thu gọn Liên hệ: SĐT 1 093 208 **** Hiện số Thông tin chi tiết Mặt tiền 4m Chiều sâu 15m Mức độ giao dịch Càng sớm càng tốt Ưu điểm BĐS Kinh doanh được, Giao thông thuận lợi",4m,15m,Càng sớm càng tốt,"Kinh doanh được, Giao thông thuận lợi",,,
306309421,1,"Cơ hội sở hữu căn nhà cực phẩm tại khu vực trung tâm Quận 5, vị trí đắc địa, hiếm có khó tìm trên thị trường","6,8 tỷ",6.8,"161,9 triệu/m²",42,N/A,"Đ. An Bình, P. 6, Q. 5, Tp. Hồ Chí Minh",3,3,30/12/2025,https://meeyland.com/ban-nha-rieng-quan-5-ho-chi-minh-i1223/306309421,"Cơ hội sở hữu căn nhà cực phẩm tại khu vực trung tâm Quận 5, vị trí đắc địa, hiếm có khó tìm trên thị trường. Địa chỉ: 67 An Bình, Phường 6, Quận 5, Thành phố Hồ Chí Minh. Diện tích ấn tượng: 4.2m x 10m, nở hậu tài lộc lên đến 8.6m, diện tích công nhận trên sổ là 68m2, đảm bảo sự vuông vắn và vượng khí cho gia chủ. Kết cấu vững chắc: 1 trệt, 1 lầu, bố trí 3 phòng ngủ và 3 toilet tiện nghi, đáp ứng hoàn hảo nhu cầu sinh hoạt của cả gia đình. Vị trí vàng: Nằm ngay trung tâm, giáp ranh các quận sầm uất như Quận 1, Quận 3, Quận 10, Quận 11. Xung quanh đầy đủ tiện ích: bệnh viện, trường học, siêu thị, khu dân cư an ninh, yên tĩnh, mang đến cuộc sống tiện nghi và đẳng cấp. Pháp lý minh bạch: Sổ hồng riêng, hoàn công đầy đủ, sẵn sàng giao dịch. Giá bán: 6.8 tỷ đồng. Liên hệ ngay: 0908502922 để không bỏ lỡ cơ hội sở hữu căn nhà mơ ước này Thu gọn Liên hệ: SĐT 1 090 850 **** Hiện số Thông tin chi tiết Mặt tiền 4,2m Chiều sâu 10m Mức độ giao dịch Gấp Ưu điểm BĐS Dân trí cao, Giao thông thuận lợi, Vị trí trung tâm, Gần nhiều tiện ích","4,2m",10m,Gấp,"Dân trí cao, Giao thông thuận lợi, Vị trí trung tâm, Gần nhiều tiện ích",,,
105416876,1,"Bán rẻ nhà phố 80m2 - 1 trệt 3 lầu Trần Bình Trọng, quận 5, Hồ Chí Minh","14,6 tỷ",14.6,"182,5 triệu/m²",80,N/A,Thu gọn,5,5,29/12/2025,https://meeyland.com/ban-nha-rieng-quan-5-ho-chi-minh-i1223/105416876,"- Giảm giá mạnh bán nhanh trong tuần nhà phố hẻm xe hơi Trần Bình Trọng phường 1 Quận 5 Thành phố Hồ Chí Minh, khu dân cư hiện hữu, trí thức, an ninh, thoáng mát. - Dễ dàng kết nối Q1, Q3, Q10, giao thông thuận tiện, chỉ mất 5 phút xe máy tới chợ Bến Thành, gần ngân hàng, trung tâm thương mại, trường học, cửa hàng tiện lợi... - Tiện nghi đầy đủ, DT 4 x 20m gồm 1 trệt 2 lầu sân thượng, 1 phòng khách 5 phòng ngủ 3WC và bếp xinh, hướng đông bắc mát mẻ sinh khí, tiện mở văn phòng Cty hoặc kinh doanh nhiều lĩnh vực khác. - Pháp lý: sổ hồng, giá rẻ 14.6 tỷ ( bớt lộc cho khách thiện chí). - Vui lòng liên hệ A Sơn. 0817.40.9696. Thu gọn Liên hệ: SĐT 1 081 740 **** Hiện số Thông tin chi tiết Mặt tiền 4m Chiều sâu 20m Số ban công 3 Mức độ giao dịch Gấp Hướng ban công Đông Bắc Tiện ích Khu để xe Ưu điểm BĐS Cho thuê giá cao, Quy hoạch ổn định, Vị trí trung tâm, Gần nhiều tiện ích, Gần mặt đường Thu gọn",4m,20m,Gấp,"Cho thuê giá cao, Quy hoạch ổn định, Vị trí trung tâm, Gần nhiều tiện ích, Gần mặt đường",3,Đông Bắc,Khu để xe
305258876,1,"Top nhà xinh rẻ 8m x 20m, 1 trệt 3 lầu Nguyễn Chí Thanh, Quận 5, thành phố Hồ Chí Minh",33 tỷ,33.0,"206,25 triệu/m²",160,N/A,Thu gọn,4,4,29/12/2025,https://meeyland.com/ban-nha-rieng-quan-5-ho-chi-minh-i1223/305258876,"- Giảm giá mạnh bán nhanh trong tuần nhà phố hẻm xe hơi 7m Nguyễn Chí Thanh, phường 9, Quận 5, Thành phố Hồ Chí Minh, khu dân cư hiện hữu, trí thức, an ninh, thoáng mát. - Dễ dàng kết nối Q1, Q3, Q5, Q10, giao thông thuận tiện, chỉ mất 8 phút xe máy tới chợ Bến Thành, gần ngân hàng, trung tâm thương mại, trường học, cửa hàng tiện lợi... - Kiến trúc hiện đại, tiện nghi đầy đủ, DT 8 x 20m gồm 1 trệt 3 lầu, 1 phòng khách, 1 phòng thờ, 4 phòng ngủ 6WC và bếp xinh, thang máy hướng tây bắc mát mẻ sinh khí, tiện mở văn phòng Cty hoặc kinh doanh nhiều lĩnh vực khác. - Pháp lý: sổ hồng, giá rẻ 33 tỷ ( bớt lộc cho khách thiện chí). - Hãy gọi ngay A Sơn 0817.40.9696 để được hỗ trợ uy tín, nhiệt tình, tận tâm. Thu gọn Liên hệ: SĐT 1 081 740 **** Hiện số Thông tin chi tiết Mặt tiền 8m Chiều sâu 20m Số ban công 3 Mức độ giao dịch Gấp Hướng ban công Tây Bắc Tiện ích Sân chơi, Thang máy, Khu để xe Ưu điểm BĐS Cho thuê giá cao, Dân trí cao, Giao thông thuận lợi, Vị trí trung tâm, Gần nhiều tiện ích Thu gọn",8m,20m,Gấp,"Cho thuê giá cao, Dân trí cao, Giao thông thuận lợi, Vị trí trung tâm, Gần nhiều tiện ích",3,Tây Bắc,"Sân chơi, Thang máy, Khu để xe"
304994749,1,"Bán lỗ nhà Nguyễn Trãi, quận 5, giá 3,77 tỷ, diện tích 52m2, hẻm thông rộng rãi 6m","3,77 tỷ",3.77,"72,5 triệu/m²",52,N/A,"Đ. Nguyễn Trãi, P. 3, Q. 5, Tp. Hồ Chí Minh",4,4,29/12/2025,https://meeyland.com/ban-nha-rieng-quan-5-ho-chi-minh-i1223/304994749,"Bán lỗ nhà Nguyễn Trãi, quận 5, giá 3,77 tỷ, diện tích 52m2, Như 0766372453, hẻm thông rộng rãi 6m. Diện tích 52m2 (4m x 13m) Kết cấu 1 trệt, 2 lầu, 4pn, 5wc Khu dân cư đông đúc, kinh doanh buôn bán đa dạng các ngành nghề, tiện ích xung quanh đầy đủ: chợ, siêu thị, trường học, bệnh viện,... Nhà đang cho thuê 15 triệu/ tháng. Thích hợp mua ở hoặc cho thuê. Gọi ngay 0766372453 gặp Quỳnh Như xem nhà trực tiếp. Thu gọn Liên hệ: SĐT 1 076 637 **** Hiện số Thông tin chi tiết Mặt tiền 4m Chiều sâu 13m Mức độ giao dịch Càng sớm càng tốt Ưu điểm BĐS Gần nhiều tiện ích",4m,13m,Càng sớm càng tốt,Gần nhiều tiện ích,,,
305996029,1,"Đất vàng mặt tiền Trần Hưng Đạo, Cà Mau, kinh doanh đỉnh, lợi nhuận cao","7,15 tỷ",7.15,"84,12 triệu/m²",85,N/A,"Q. 5, Tp. Hồ Chí Minh",,,29/12/2025,https://meeyland.com/ban-dat-quan-5-ho-chi-minh-i1123/305996029,"Cơ hội đầu tư không thể bỏ lỡ! Sở hữu ngay nền đất mặt tiền đường Trần Hưng Đạo, phường 5, Cà Mau, vị trí đắc địa gần đường Ba Tháng Hai. Diện tích đất 5m x 17m, thực tế sử dụng lên đến 5m x 23m, full thổ cư. Nền đất mặt tiền đẹp, thoáng đãng, lý tưởng để thiết kế cửa hàng, quán ăn, văn phòng, spa... Lộ giới và vỉa hè rộng rãi, giao thông tấp nập, thuận tiện di chuyển. Đang có sẵn nguồn thu nhập ổn định từ việc cho thuê. Khu dân cư đông đúc, tiện ích đầy đủ, phù hợp kinh doanh buôn bán hoặc đầu tư sinh lời lâu dài. Hướng Đông Nam. Giá bán: 7.15 tỷ. Liên hệ ngay Thiện: 0948525385 để không bỏ lỡ cơ hội đầu tư hấp dẫn này! Thu gọn Liên hệ: SĐT 1 094 852 **** Hiện số Thông tin chi tiết Mặt tiền 5m Chiều sâu 17m Mức độ giao dịch Càng sớm càng tốt Ưu điểm BĐS Kinh doanh được, Giao thông thuận lợi, Vị trí trung tâm, Gần nhiều tiện ích",5m,17m,Càng sớm càng tốt,"Kinh doanh được, Giao thông thuận lợi, Vị trí trung tâm, Gần nhiều tiện ích",,,
306060129,1,"Nền đất full thổ cư Vĩnh Long, khu dân cư an lành, đầu tư đỉnh","1,4 tỷ",1.4,14 triệu/m²,100,N/A,"Q. 5, Tp. Hồ Chí Minh",,,26/12/2025,https://meeyland.com/ban-dat-quan-5-ho-chi-minh-i1123/306060129,"Bán nền đất đường 7A khu Minh Linh, phường 5, Vĩnh Long. Diện tích: 5m x 20m 100m2, full thổ cư. Hướng: Tây Nam. Vị trí nền đất nằm ở khúc ngoài ủy ban, không vướng cống, cây xanh, cực kỳ thoáng đãng. Giá bán: 1.4xx tỷ. Liên hệ ngay 0934997137 để chốt kèo thơm nhé! Thu gọn Liên hệ: SĐT 1 093 499 **** Hiện số Thông tin chi tiết Mặt tiền 5m Chiều sâu 20m Mức độ giao dịch Càng sớm càng tốt Ưu điểm BĐS Giao thông thuận lợi",5m,20m,Càng sớm càng tốt,Giao thông thuận lợi,,,
