306331784,5,"Bán gấp nhà hẻm Tân Thành, P.15, Q.5, (48m2) giá chỉ 2tỷ120, hẻm 5m",9 tỷ,9.0,"187,5 triệu/m²",48,N/A,"Đ. Tân Thành, P. 12, Q. 5, Tp. Hồ Chí Minh",3,3,02/01/2026,https://meeyland.com/ban-nha-rieng-quan-5-ho-chi-minh-i1223/306331784,"* * * * * BÁN GẤP NHÀ HẺM 228 TÂN THÀNH P.15, Q.5 * * * * * - Diện tích: 48m² (4,5 x 10,5) - Cấu trúc: 1trệt 1ầu 3 phòng ngủ 2WC - GIÁ Vị trí vàng - Hẻm 228 Tân Thành, P.15, Q.5 - Khu người Hoa sầm uất, an ninh, văn hóa đặc trưng - Gần chợ Cơ Khí Tạ Uyên, đầy đủ tiện ích xung quanh - Giao ngay đường Tân Thành, di chuyển thuận tiện sang Q.10 Q.6 Q.11 Liên hệ: 0335379482 - Thúy để giữ giá tốt và xem nhà ngay Liên hệ: SĐT 1 033 537 **** Hiện số",,,,,,,
306316394,5,"Góc 2MT Nguyễn Biểu Quận 5- giáp Quận 1- DT: 4m x 19m- 4 tầng. Gía chỉ 25,2 tỷ","25,2 tỷ",25.2,"327,27 triệu/m²",77,N/A,"Đ. Nguyễn Biểu, P. 1, Q. 5, Tp. Hồ Chí Minh",,,02/01/2026,https://meeyland.com/ban-nha-rieng-quan-5-ho-chi-minh-i1223/306316394,"* Siêu phẩm Căn góc 2 mặt tiền đường Nguyễn Biểu Q5 đoạn đẹp sang trọng và có mức giá giảm rất sâu để bán trước Tết. * Cụ thể Tài sản có thông số diện tích - Ngang 4m dài 19m nở hậu nhẹ công nhận 77m² - Kết cấu. 4 Tầng vỉ hè rộng rãi * Vị trí Căn nhà rất là Đẹp , Cách đường Trần Hưng Đạo tầm 50m . Khu này rất sang trọng , kinh doanh nhộn nhịp uất , tập trung rất nhiều nghành nghề . * Ở đoạn Đẹp này quý anh chị rất dễ kinh doanh và cho thuê , liền kề nhà mình là Ngân hàng , Thẩm Mỹ viện , nhà hàng . Từ vị trí nhà mình chạy ra trung tâm chợ Bến Thành Q1 tầm 5-10 phút . Gía bán: 25,2 tỷ TL Liên hệ: 0918320011- Nhà Phố Phú Lộc Thu gọn Liên hệ: SĐT 1 091 832 **** Hiện số Thông tin chi tiết Ưu điểm BĐS Đất vuông - nở hậu, Căn góc, Phân lô liền kề",,,,"Đất vuông - nở hậu, Căn góc, Phân lô liền kề",,,
306328187,5,"Chủ đi định cư nước ngoài gửi bán gấp nhà Hồng Bàng, Quận 5 - DT 47,3m2 - SHR sang tên ngay",N/A,,N/A,47.3,N/A,"Đ. Hồng Bàng, P. 12, Q. 5, Tp. Hồ Chí Minh",4,4,02/01/2026,https://meeyland.com/ban-nha-rieng-quan-5-ho-chi-minh-i1223/306328187,"Ngay trung tâm Quận 5, bán Hồng Bàng 47,3m2 vào ở ngay: Kết cấu: 1 trệt 1 lầu, 3 phòng ngủ, 3 WC. Diện tích: 47,3m2 (4,5x10m). Vị trí: Hẻm 1/, ngay trường THCS Hậu Giang, giao Ba Tháng Hai, bán kính 500m đầy đủ chợ, ngân hàng, CHTL. Sổ hồng riêng, pháp lý rõ ràng, đã hoàn công, công chứng ngay. Liên hệ: Gặp Kim Tuyết 0787782047 làm việc trực tiếp chủ nhà. Có nhận ký gửi nhà đất trong và ngoài thành phố. Miễn cò. Liên hệ: SĐT 1 078 778 **** Hiện số Thông tin chi tiết Mặt tiền 4,5m","4,5m",,,,,,
306331281,5,Không có căn thứ 2 ở Q5. chỉ 2 tyr480 có nagy căn Huỳnh Mẫn Đạt Q5,"2,48 tỷ",2.48,"49,6 triệu/m²",50,N/A,"P. 2, Q. 5, Tp. Hồ Chí Minh",,,02/01/2026,https://meeyland.com/ban-nha-rieng-quan-5-ho-chi-minh-i1223/306331281,"Diện tích: 50m² Vị trí: Huỳnh Mẫn Đạt, Q.5 khu trung tâm, dân cư ổn định Nhà gọn gàng, thuận tiện ở hoặc cho thuê Sổ hồng riêng, pháp lý rõ ràng Giá: 2 TỶ 480 TRIỆU (còn thương lượng) Liên hệ: 0785809678 Tấn Phát xem nhà Liên hệ: SĐT 1 078 580 **** Hiện số",,,,,,,
306331967,5,Duplex Quận 5. 185m2. 1 căn duy nhất. 10 tỷ nhận nhà. Giá từ chủ đầu tư.,N/A,,N/A,185,N/A,"P. 1, Q. 5, Tp. Hồ Chí Minh",,,02/01/2026,https://meeyland.com/ban-can-ho-chung-cu-quan-5-ho-chi-minh-i1423/306331967,"Căn hộ cao cấp tại trung tâm TP. HCM. Căn Duplex duy nhất với tầm view ôm trọn trung tâm có thể ngắm pháo hoa. - Diện tích 185m2. - Vị trí ngay quận 5, mặt tiền đường Trần Hưng Đạo. - 2 phút là đến quận 1. - Tiện ích nội khu chuẩn 5 sao: gym, hồ bơi, bbq ngoài trời,.. - Tiện ích ngoại khu thì không phải bàn vì cần gì cũng có. - Chỉ với 10 tỷ nhận nhà ở ngay. - Sổ hồng riêng từng căn. - Pháp lý đầy đủ. Liên hệ: SĐT 1 094 998 **** Hiện số",,,,,,,
306332413,6,"Vợ chồng già bán căn nhà đường Trần Tuấn Khải-Quận 5. Giá 4TỶ4/67,2m2 thuê 26tr. Gần chợ Hòa Bình","4,4 tỷ",4.4,"vợ chồng già bán căn nhà đường trần tuấn khải-quận 5. giá 4tỷ4/67,2m2 thuê 26tr. gần chợ hòa bình",67.2,N/A,"Đ. Trần Tuấn Khải, P. 5, Q. 5, Tp. Hồ Chí Minh",4,4,02/01/2026,https://meeyland.com/ban-nha-rieng-quan-5-ho-chi-minh-i1223/306332413,"Vợ chồng già bán căn nhà còn mới keng đường Trần Tuấn Khải - Phường 5 - Quận 5. Đang cho thuê 26 triệu/tháng. * Gần Chợ Hoà Bình, bệnh viện Nhiệt Đới, bệnh viện Chấn Thương Chỉnh Hình. - Giá chốt: 4 TỶ 400 ( MIỄN TIẾP CÒ ) - Diện tích: 67,2m2 (Ngang 4m x dài 16,8m), vuông vức. - Kết cấu: 1 trệt - 1 lửng - 2 lầu Gồm phòng khách - bếp - 4 phòng ngủ - 5 nhà vệ sinh - gara ô tô - Tặng full nội thất cho khách nào thiện chí, chốt nhanh. - Thông tin minh bạch - rõ ràng - sổ sẵn - hoàn công - công chứng liền. Gọi Vy xem nhà: 0945145086 Thu gọn Liên hệ: SĐT 1 094 514 **** Hiện số",,,,,,,
306331668,6,"Nhà giáp mt trung tâm sư vạn hạnh,p9,quận 5. giá : 5tỷ770/ dt: 5mx14m (70m2).sổ hồng chính chủ","5,77 tỷ",5.77,"nhà giáp mt trung tâm sư vạn hạnh,p9,quận 5. giá : 5tỷ770/ dt: 5mx14m (70m2).sổ hồng chính chủ",70,N/A,"Đ. Sư Vạn Hạnh, P. 9, Q. 5, Tp. Hồ Chí Minh",3,3,02/01/2026,https://meeyland.com/ban-nha-rieng-quan-5-ho-chi-minh-i1223/306331668,"NHÀ GIÁP MT TRUNG TÂM SƯ VẠN HẠNH,P9,QUẬN 5. GIÁ : 5Ty770 DT: 5mx14m (70m2) KC: 1Trêt 2Lầu Sân thượng 3Phòng ngủ cơ bản - 4WC. Đường xe hơi lớn 6m, cách trục đường chính 40m. Khu an ninh, bên ngoài sầm uất ngay trung tâm nhiều tiện ích. Sổ hồng chính chủ, pháp lý chuẩn, hỗ trợ vay ngân hàng. Liên hệ: SĐT 1 093 500 **** Hiện số Thông tin chi tiết Mặt tiền 6m Ưu điểm BĐS Gần nhiều tiện ích",6m,,,Gần nhiều tiện ích,,,
306330857,6,"Cần bán nhà đường ô tô Trần Bình Trọng-P1-Q5, gần vòng xoay Dân Chủ.Giá 4 tỷ360tr/86m2,cho thuê19tr","4,36 tỷ",4.36,"cần bán nhà đường ô tô trần bình trọng-p1-q5, gần vòng xoay dân chủ.giá 4 tỷ360tr/86m2,cho thuê19tr",86,N/A,"Đ. Trần Bình Trọng, P. 1, Q. 5, Tp. Hồ Chí Minh",4,4,01/01/2026,https://meeyland.com/ban-nha-rieng-quan-5-ho-chi-minh-i1223/306330857,"Cần bán nhà hẻm đường ô tô Trần Bình Trọng - phường 1 - Quận 5, gần vòng xoay Dân Chủ, khu dân trí cao. * Giá 4 tỷ 360 triệu. - Diện tích: 86m2 (ngang 5,5m x dài 15,6m). - Kết cấu: 1 trệt - 1 lửng - 2 lầu - sân thượng. - Gồm: 4 phòng ngủ - 5 nhà vệ sinh. - Nội thất sang trọng. - Sổ hoàn công đủ - sang tên trong ngày. * Liên hệ 0948493459) gặp em Phát để được hỗ trợ xem nhà miễn phí. Liên hệ: SĐT 1 094 849 **** Hiện số Thông tin chi tiết Mặt tiền 5,5m Ưu điểm BĐS Dân trí cao","5,5m",,,Dân trí cao,,,
306330974,6,"Kí gửi đầu năm chủ cần tiền gấp bán nhanh nhà Lê Hồng Phong, P.4, Q.5 - 56m2 - Giá mềm 1 tỷ 960","1,96 tỷ",1.96,35 triệu/m²,56,N/A,"Đ. Lê Hồng Phong, P. 4, Q. 5, Tp. Hồ Chí Minh",3,3,01/01/2026,https://meeyland.com/ban-nha-rieng-quan-5-ho-chi-minh-i1223/306330974,"# BÁN NHÀ 1 TRỆT 1 LẦU - HẺM XE HƠI - ĐƯỜNG LÊ HỒNG PHONG, PHƯỜNG 4, QUẬN 5 - Vị trí: gần nút giao Hùng Vương - Diện tích: 56m² (4 x 14) - Kết cấu: 1 trệt 1 lầu - 3 phòng ngủ - 3 WC - Hẻm xe hơi, di chuyển thuận tiện các quận trung tâm - Giá bán: 1 tỷ 960 - Giá tốt cho khu vực trung tâm Q.5 - Hiện trạng nhà đang cho thuê 25 - 30tr/1 tháng khách mua về có dòng tiền ngay - Khu dân cư an ninh, gần chợ trường học, tiện ích đầy đủ ******************************************************************************* ## Liên hệ xem ngay: 0902538049 ( V.Khang) để xem nhà trực tiếp Thu gọn Liên hệ: SĐT 1 090 253 **** Hiện số Thông tin chi tiết Mặt tiền 4m",4m,,,,,,
306333349,6,"Cần bán nhà hẻm ôtô 6m 74,7m2 An Dương Vương P2 Q5. Sát ĐH Sài Gòn, đang cho thuê 23triệu",N/A,,N/A,74.7,N/A,"Đ. An Dương Vương, P. 2, Q. 5, Tp. Hồ Chí Minh",4,4,01/01/2026,https://meeyland.com/ban-nha-rieng-quan-5-ho-chi-minh-i1223/306333349,"Sát Đại học Sài Gòn 300m hẻm ôtô 6m đường An Dương Vương phường 2 Quận 5. Diện tích 74,7m2 ngang 4,5m x dài 16,6m. Xây dựng bê tông cốt thép 1 trệt 2 lầu. 4 phòng ngủ - 5 nhà vệ sinh - Gara ôtô ngủ nhà. Ban công - Giếng trời - Sân phơi. Cách mặt đường 40m hẻm 6m thông Nguyễn Trãi. Sổ hồng sẵn chính chủ - sang tên công chứng ngay. Đang có sẵn dòng tiền cho thuê 23 triệu/tháng. Giá thiện chí còn bớt. Liên hệ 0909748230 Liêm để xem nhà. Liên hệ: SĐT 1 090 974 **** Hiện số Thông tin chi tiết Mặt tiền 4,5m","4,5m",,,,,,
306331517,6,"Đáo hạn cuối năm chủ cần bán gấp nhà Nguyễn Tri Phương, P.9, Q.5 - 60m2 - 3 tầng - Giá 2 tỷ 360","2,36 tỷ",2.36,"39,33 triệu/m²",60,N/A,"Đ. Nguyễn Tri Phương, P. 9, Q. 5, Tp. Hồ Chí Minh",4,4,01/01/2026,https://meeyland.com/ban-nha-rieng-quan-5-ho-chi-minh-i1223/306331517,"# BÁN NHÀ 1 TRỆT 2 LẦU - HẺM XE HƠI - ĐƯỜNG NGUYỄN TRI PHƯƠNG, PHƯỜNG 9, QUẬN 5 - Vị trí: gần nút giao An Dương Vương - Diện tích: 60m² (4 x 15) - Kết cấu: 1 trệt 2 lầu 1 thượng - 4 phòng ngủ - 5 WC - Hẻm xe hơi, di chuyển thuận tiện các quận trung tâm - Giá bán: 2 tỷ 360 - Giá tốt cho khu vực trung tâm Q.5 - Hiện trạng nhà đang cho thuê 18 - 20tr/1 tháng khách mua về có dòng tiền ngay - Khu dân cư an ninh, gần chợ trường học, tiện ích đầy đủ ******************************************************************************* ## Liên hệ xem ngay: 0902538049 ( V.Khang) để xem nhà trực tiếp Thu gọn Liên hệ: SĐT 1 090 253 **** Hiện số Thông tin chi tiết Mặt tiền 4m",4m,,,,,,
306314691,6,"Bán nhà siêu phẩm 5 tầng phường an bình quận 5 giáp võ văn kiệt - dt 82m2 - mt 7,6m - full nội thất","19,5 tỷ",19.5,"237,8 triệu/m²",82,N/A,"Đ. An Bình, P. 5, Q. 5, Tp. Hồ Chí Minh",5,,01/01/2026,https://meeyland.com/ban-nha-rieng-quan-5-ho-chi-minh-i1223/306314691,"BÁN NHÀ SIÊU PHẨM 5 TẦNG PHƯỜNG AN BÌNH QUẬN 5 GIÁP VÕ VĂN KIỆT - DT 82m2 - MT 7,6m - FULL NỘI THẤT - CÓ SẴN THANG MÁY - THÍCH HỢP CHO MUA Ở, ĐẦU TƯ CHO THUÊ CHDV, MỠ SPA, KINH DOANH ĐA NGÀNH NGHỀ - SÁT CÔNG VIÊN THOÁNG MÁT - Diện tích: Ngang 7,6m Dài 11m (ngang hiếm khu trung tâm) - Kết cấu: 1 trệt 3 lầu sân thượng, 5 tầng kiên cố - Trang bị thang máy, nội thất cao cấp, chủ xây ở tâm huyết - Sân rộng, thoáng, xe hơi ngủ trong nhà - Hẻm nhựa 6m, trước nhà thông thoáng 12m - Cách mặt tiền đường chỉ 100m - Khu nhà cao tầng đồng bộ, dân trí cao, an ninh tuyệt đối - Gần chợ An Đông, An Đông Plaza - Gần công viên, khu vui chơi, khu ăn uống sầm uất - Nhanh ra Nguyễn Trãi Trần Hưng Đạo Hồng Bàng - Di chuyển Quận 1 Quận 10 Quận 6 chỉ vài phút - Xung quanh đầy đủ trường học, bệnh viện, ngân hàng, siêu thị PHÁP LÝ - Sổ hồng chính chủ - Hoàn công đầy đủ - Công chứng sang tên nhanh gọn Thu gọn Liên hệ: SĐT 1 096 194 **** Hiện số Thông tin chi tiết Mặt tiền 7,6m Tiện ích Thang máy Ưu điểm BĐS Dân trí cao, Giáp vườn hoa công viên","7,6m",,,"Dân trí cao, Giáp vườn hoa công viên",,,Thang máy
306331137,6,"Sở hữu ngay Tòa nhà Nguyễn Tri Phương, Quận 10, 8x22m, Hầm+ 6 tầng - HĐT: 220 triệu, giá 69 tỷ",69 tỷ,69.0,"392,05 triệu/m²",176,N/A,"Đ. Nguyễn Tri Phương, P. 7, Q. 5, Tp. Hồ Chí Minh",,,01/01/2026,https://meeyland.com/ban-nha-rieng-quan-5-ho-chi-minh-i1223/306331137,"Chính chủ cần bán gấp tòa nhà mặt tiền Nguyễn Tri Phương, Phường 9, Quận 10 - DT: 8x23m, vuông vắn. - KC: Hầm + 6 tầng - thang máy. - Thu nhập: 220 triệu/tháng - Giá: 68 tỷ. - Pháp lý: Cá nhân. - Vị trí: Đoạn đẹp sầm uất, gần Hòa Hảo - Phố ấm thực - 2 chiều kinh doanh sầm uất Xem nhà ngay liên hệ: 0902977330 Trúc Phương. Liên hệ: SĐT 1 090 297 **** Hiện số Thông tin chi tiết Mặt tiền 8m Tiện ích Thang máy",8m,,,,,,Thang máy
306330559,6,"Nhà Chính Chủ Cần Bán Gấp, Đ.Châu Văn Liêm, P4, Q5, DT 55m2, Giá 2 tỷ 690tr, Sổ Hồng Riêng Chính CH","2,69 tỷ",2.69,"48,91 triệu/m²",55,N/A,"Đ. Châu Văn Liêm, P. 4, Q. 5, Tp. Hồ Chí Minh",2,2,02/01/2026,https://meeyland.com/ban-nha-rieng-quan-5-ho-chi-minh-i1223/306330559,"NHÀ CHÍNH CHỦ CẦN BÁN GẤP NGANG 5M TRUNG TÂM QUẬN 5 Đường Châu Văn Liêm, Phường 4, Quận 5, TP.HCM THÔNG TIN CĂN NHÀ - Giá bán: 2 tỷ 690 triệu (thương lượng) - Diện tích: 55m² (ngang 5m x dài 11m) - Kết cấu: 1 trệt 2 lầu, 2PN, 2WC, phòng khách, bếp, full nội thất - Giá thuê tiềm năng: 25 triệu/tháng * VỊ TRÍ & TIỆN ÍCH: Khu vực Châu Văn Liêm Quận 5 sầm uất, Kết nối nhanh Quận 1 Quận 10 Quận 6 Quận 11, Gần chợ, trường học, bệnh viện, trung tâm thương mại, tuyến xe buýt, Khu dân cư đông, nhu cầu thuê cao quanh năm * PHÁP LÝ: Sổ hồng riêng chính chủ - Hoàn công đầy đủ - Công chứng sang tên nhanh Thu gọn Liên hệ: SĐT 1 085 780 **** Hiện số",,,,,,,
306318928,6,"Bán căn hộ 2PN, 1WC, 86m2 tại Võ Văn Kiệt, Q5, HCM, giá ưu đãi 3 tỷ VND",3 tỷ,3.0,"34,88 triệu/m²",86,N/A,"Đ. Võ Văn Kiệt, P. 13, Q. 5, Tp. Hồ Chí Minh",2,2,01/01/2026,https://meeyland.com/ban-can-ho-chung-cu-quan-5-ho-chi-minh-i1423/306318928,"Căn hộ chung cư này tọa lạc tại địa chỉ 1354 lầu 4, Võ Văn Kiệt, phường 13, Quận 5, Hồ Chí Minh, với diện tích 86m2. Căn hộ có thiết kế 2PN + 1WC, hướng cửa chính và ban công đều hướng Đông Nam, mang lại không gian thoáng đãng và ánh sáng tự nhiên. Căn hộ được trang bị nội thất cơ bản bao gồm máy lạnh cho 2 phòng ngủ, rèm cửa. - Tất cả phòng khách + 2 phòng ngủ đều có view sông, vì bề ngang mặt tiền nhà rộng: 12m. - Hướng Đông Nam, cả ngày không bị ánh nắng chiếu trực tiếp, view sông Võ Văn Kiệt. - Không gian sống: Tuy là chung cư nhưng chỉ có 4 hộ, mỗi hộ ở 1 lầu nên yên tĩnh, an ninh... - Giao thông: Nằm trên trục đường Võ Văn Kiệt, ngay Quận 5 nên thuận tiện giao thông, không kẹt xe. - Đi đến: + Chợ Bình Tây: 900m, + Chợ Kim Biên: 450m, + Bến xe Chợ Lớn: 1km, + Siêu thị Centre Mall: 900m, + Trường Mầm non 13: 100m, + Trường tiểu học Lê Đình Chinh: 170m, - Có chỗ để xe gắn máy riêng (dưới tầng trệt), một hộ gia đình được để 03 xe gắn máy. - Điện: Đồng hồ điện lực: Đóng tiền trực tiếp Điện lực theo hóa đơn hàng tháng, - Nước: Đồng hồ nước riêng (đồng hồ phụ), các hộ (03 hộ) chia nhau theo Hóa đơn nước của đồng hồ chính. Giá bán: 3 tỷ. Để biết thêm thông tin chi tiết, vui lòng liên hệ qua số điện thoại 0983801355 [Ms. Hiền], chính chủ. Thu gọn Liên hệ: SĐT 1 098 380 **** Hiện số Thông tin chi tiết Hướng ban công Đông Nam",,,,,,Đông Nam,
306324591,6,Toà nhà mới 100% MT Võ Văn Kiệt - 10x35m - 2 Hầm 10 Tầng - HĐT 300 triệu/th - giá 130 tỷ,130 tỷ,130.0,"388,06 triệu/m²",335,N/A,"Đ. Võ Văn Kiệt, P. 2, Q. 5, Tp. Hồ Chí Minh",,,01/01/2026,https://meeyland.com/ban-nha-rieng-quan-5-ho-chi-minh-i1223/306324591,Toà nhà mới 100% MT Võ Văn Kiệt - Diện tích: 10x35m - Kết cấu: 2 Hầm 10 Tầng mới 100% - Hoàn công + PCCC đầy đủ - HĐ thuê 300 triệu/tháng mới ký 5 năm - Giá 130 tỷ TL Liên hệ: 0938134138 - Thanh Tùng Liên hệ: SĐT 1 093 813 **** Hiện số,,,,,,,
306332214,6,Trung tâm quận 5. bán gấp nhà đường lão tử. p14. q5. giá 19 tỷ.,19 tỷ,19.0,"316,67 triệu/m²",60,N/A,"Đ. Lão Tử, P. 14, Q. 5, Tp. Hồ Chí Minh",3,,01/01/2026,https://meeyland.com/ban-nha-rieng-quan-5-ho-chi-minh-i1223/306332214,"BÁN GẤP NHÀ ĐƯỜNG LÃO TỬ. P14. Q5. GIÁ 19 TỶ. Mr Tùng 0568193333 & 0568193333 Mặt tiền chợ rất hiếm bán, nay chủ kẹt tiền bán trước Tết. Diện tích sổ nở hậu 5,10m. ( 4,10x12,8) đủ 58m2. Thiết kế hiện đại 7 tầng. Hiện có 3PN.6WC Còn lại đều để thoáng. Khu vực buôn bán sầm uất nhất nhì quận 5 Ngay ngã tư Châu Văn Liêm và Lão Tử. Pháp lý sạch, giao dịch ngay. Liên hệ: SĐT 1 056 819 **** Hiện số Thông tin chi tiết Mặt tiền 4,1m Ưu điểm BĐS Đất vuông - nở hậu","4,1m",,,Đất vuông - nở hậu,,,
306330444,6,"Nhà bán ngay chợ an đông đường trần phú, phường 4, quận 5 - chỉ 5 tỷ 360/ 63m2(4,5x14) - sổ đẹp","5,36 tỷ",5.36,"nhà bán ngay chợ an đông đường trần phú, phường 4, quận 5 - chỉ 5 tỷ 360/ 63m2(4,5x14) - sổ đẹp",63,N/A,"P. 4, Q. 5, Tp. Hồ Chí Minh",3,3,01/01/2026,https://meeyland.com/ban-nha-rieng-quan-5-ho-chi-minh-i1223/306330444,"bán nhà gần ngay chợ an đông vị trí ở trần phú, phường 4, quận 5 - khu vực đông dân cư, sầm uất.  - chốt giá 5 tỷ 360 triệu - diện tích: 63m2 (ngang 4,5m dài 14m).  - kết cấu: 1 trệt, 2 lầu gồm phòng khách, bếp, 3 phòng ngủ, 4wc, phòng thờ, sân thượng rộng rãi.  - xung quanh nhiều tiện ích, hẻm rộng thuận tiện di chuyển ra các đường lớn.  - sổ hồng riêng chính chủ, pháp lý chuẩn, hoàn công đầy đủ.  gọi toàn 0909761569 để xem trực tiếp!!! Liên hệ: SĐT 1 090 976 **** Hiện số Thông tin chi tiết Ưu điểm BĐS Gần nhiều tiện ích",,,,Gần nhiều tiện ích,,,
306309735,6,Nhà mặt tiền hẻm 5m đường An Bình P5 Q5,"19,5 tỷ",19.5,"237,8 triệu/m²",82,N/A,"Đ. An Bình, P. 5, Q. 5, Tp. Hồ Chí Minh",,,01/01/2026,https://meeyland.com/ban-nha-rieng-quan-5-ho-chi-minh-i1223/306309735,"Mặt tiền nhựa 5m đường An Bình Q5. DT 7,6x11m- 82m2 trệt 3 lầu + sân thượng. Vị trí đẹp gần cầu nguyễn tri phương. Sổ hồng riêng - Giá 19,5 tỷ - LH 0919121839 Liên hệ: SĐT 1 091 912 **** Hiện số Thông tin chi tiết Mặt tiền 7,6m","7,6m",,,,,,
306330147,6,Hẻm 8m an bình q5 - nhà mới - ngang 7.6 - 6 tầng - có thang máy,"19,5 tỷ",19.5,"237,8 triệu/m²",82,N/A,"P. 5, Q. 5, Tp. Hồ Chí Minh",,,01/01/2026,https://meeyland.com/ban-nha-rieng-quan-5-ho-chi-minh-i1223/306330147,"Vị trí trung tâm Quận 5, hẻm 8m rộng rãi, xe hơi tránh nhau, khu dân cư văn minh an ninh. Kết nối nhanh Nguyễn Trãi, Hồng Bàng, Trần Hưng Đạo, thuận tiện ở, làm văn phòng hoặc khai thác cho thuê. Diện tích: 7.6 11m 82,1m² Kết cấu: 5 tầng + sân thượng + thang máy Hiện trạng: nhà trống, dọn vào sử dụng ngay Phù hợp mở CHDV, văn phòng công ty, spa, trung tâm đào tạo Giá bán: 19,5 tỷ (thương lượng) Tài sản hiếm phân khúc diện tích lớn thang máy hẻm rộng Quận 5. Liên hệ: SĐT 1 091 805 **** Hiện số Thông tin chi tiết Tiện ích Thang máy Ưu điểm BĐS Vị trí trung tâm",,,,Vị trí trung tâm,,,Thang máy
306327070,6,"Bán nhà đường Ngô Quyền, Quận 5 . DT 75m2 / Giá 3 tỷ 990 . Nhà 2 tầng , gần ĐH y dược","3,99 tỷ",3.99,"bán nhà đường ngô quyền, quận 5 . dt 75m2 / giá 3 tỷ 990 . nhà 2 tầng , gần đh y dược",75,N/A,"Đ. Ngô Quyền, P. 7, Q. 5, Tp. Hồ Chí Minh",,,01/01/2026,https://meeyland.com/ban-nha-rieng-quan-5-ho-chi-minh-i1223/306327070,"Vị trí : đường Ngô Quyền , Phường 7 , Quận 5 Sát bên Trường Đại Học Y Dược , Bệnh Viện Phạm Ngọc Thạch . - Nhà 2 tầng 5 phòng ngủ , 5 nhà vệ sinh , có sân thượng trồng cây , phòng thờ , ban công , sân để ô tô - Diện tích : 75m2 ( 5,2m x 14m ) - sổ hồng chính chủ , đường ô tô rộng rải , đang cho thuê Kinh Doanh buôn bán . - Liên Huệ qua xem nhà : 0906942863 Liên hệ: SĐT 1 090 694 **** Hiện số",,,,,,,
306328959,6,"Còn tin là còn nhà! Chính chủ mặt tiền Trần Phú, Q. 5. DT: 67m2 (5x13,4) sổ hồng riêng",N/A,,N/A,67,N/A,"P. 8, Q. 5, Tp. Hồ Chí Minh",,,01/01/2026,https://meeyland.com/ban-nha-rieng-quan-5-ho-chi-minh-i1223/306328959,"Thông tin chính xác, còn tin là còn nhà. Bán nhà mặt tiền Trần Phú, Phường 8, Quận 5 đoạn 2 chiều cực kỳ đẹp. - Nhà diện tích cực kỳ đẹp phong thủy tốt. - DT 67m2 ngang 5 dài 13,4. - Nhà 3 tầng cực kỳ đẹp nội thất cao cấp, bồn tắm không gian mở vào ở ngay không phải sửa chữa. - Nhà chính chủ đang ở nên đầu tư rất kỹ lưỡng cho nội thất. - Nay gia đình cần tiền làm ăn nên bán căn nhà tâm huyết giá thỏa thuận thương lượng cho khách hàng thiện chí thanh toán nhanh. Cam kết thông tin chính xác, còn tin là còn nhà. Liên hệ: Hà 0989748408 Thu gọn Liên hệ: SĐT 1 098 974 **** Hiện số Thông tin chi tiết Mặt tiền 5m",5m,,,,,,
306325306,6,"Chú Tám chủ nhà bán nhà tại Quận 5 Gần Quận 1 DT 75m2, SHR, Liên hệ 0901388248",N/A,,N/A,75,N/A,"Đ. Nguyễn Văn Cừ, P. 2, Q. 5, Tp. Hồ Chí Minh",5,,01/01/2026,https://meeyland.com/ban-nha-rieng-quan-5-ho-chi-minh-i1223/306325306,"Bán Nhà Tại Đường Nguyễn Văn Cừ, Phường 2, Quận 5 - giá cực tốt cho khách hàng trong dịp cận Tết. - Diện tích: 75m². - Kích thước: Ngang 4,5m, dài 16,6m. Kết cấu: 1 trệt 3 lầu. Công năng: 5 phòng ngủ, 6 WC. - Ban công đầy đủ các tầng, nhà thông thoáng. - Nhà xây dựng kiên cố, thiết kế đẹp, sử dụng ngay. - Pháp lý: Sổ hồng riêng, hoàn công đầy đủ, pháp lý chuẩn. - Hiện trạng: Đang có hợp đồng thuê. - Giá thuê hiện tại: 20 triệu/tháng. Phù hợp mua ở kết hợp đầu tư, giữ tiền và tạo dòng tiền ổn định. - Vị trí và tiện ích xung quanh: Trục Nguyễn Văn Cừ, kết nối nhanh Quận 1, Quận 5, Quận 10. Gần Đại học Y Dược, Đại học Khoa học Tự nhiên, Đại học Sài Gòn. Gần Bệnh viện Chợ Rẫy, Bệnh viện Hùng Vương. Khu vực sầm uất, đầy đủ chợ, siêu thị, ngân hàng, cửa hàng tiện lợi. - Nhu cầu thuê cao, khu dân cư đông đúc, an ninh tốt. Thương lượng cho khách thiện chí. Làm việc trực tiếp, nhanh gọn liên hệ 0901388248 Bảo Yến Để Thêm Thông Tin. Thu gọn Liên hệ: SĐT 1 090 138 **** Hiện số Thông tin chi tiết Mặt tiền 5,5m","5,5m",,,,,,
306325803,6,Siêu phẩm võ văn kiệt q5 hẻm 4 mét 4 tầng/ 5 pn vuông a4,"6,7 tỷ",6.7,"279,17 triệu/m²",24,N/A,"Đ. Võ Văn Kiệt, P. 1, Q. 5, Tp. Hồ Chí Minh",5,5,01/01/2026,https://meeyland.com/ban-nha-rieng-quan-5-ho-chi-minh-i1223/306325803,"Địa Chỉ: Võ Văn Kiệt, P.1, Q5 Tiện ích vị trí: Hẻm 4 mét thông tứ tung ra Trần Bình Trọng, Cao Đạt Giao thông thuận tiện, kết nối nhanh đến các quận 3 - 10 - Q1 Tiện ích bủa vây: gần chợ Cao Đạt, Siêu Thị Diện tích: 3 x 8m Công năng: Đang cho thuê 20tr/1th - Đất Thổ Cư Pháp lý: Sổ đẹp vuông vức, hoàn công đủ, công chứng ngay Kết cấu: 4 Tầng - 5PN 4WC Liên hệ: SĐT 1 035 388 **** Hiện số Thông tin chi tiết Ưu điểm BĐS Giao thông thuận lợi",,,,Giao thông thuận lợi,,,
