306308738,10,"Bán chung cư Quận 5, Hồ Chí Minh giá rẻ (1/2026)",N/A,,N/A,,N/A,Căn hộ chung cư,,,N/A,https://meeyland.com/ban-can-ho-chung-cu-quan-5-ho-chi-minh-i1423/306308738,N/A,,,,,,,
306307776,10,Bán Nhà Mặt Tiền Tân Hưng Quận 5 Gần Đại Học Y Dược - 49m2 5 Tầng Chủ 12 Tỷ 35 TL,"12,35 tỷ",12.35,"252,04 triệu/m²",49,N/A,"Đ. Tân Hưng, P. 12, Q. 5, Tp. Hồ Chí Minh",5,5,29/12/2025,https://meeyland.com/ban-nha-rieng-quan-5-ho-chi-minh-i1223/306307776,"Cạnh Thuận Kiểu Plaza - MT Tân Hưng Quận 5 - 49m2 5 Tầng 5 PN - Chỉ 12 Tỷ 35 Diện tích : 49m2 ( 3.2 x 18 ) 1 trệt 3 lầu sân thượng, 5 PN 4 Tolet Vị trí đẹp kinh doanh nhộn nhịp, cạnh chợ Tân Thành, Garden Mall, BV Chợ Rẫy, Hùng Vương Plaza, ĐH Y Dược Liên hệ: SĐT 1 093 168 **** Hiện số Thông tin chi tiết Mặt tiền 3,2m","3,2m",,,,,,
306304080,10,"Bán gấp! Bán nhà MT An Dương Vương DT: 6,5x21m hầm 7 tầng - HĐT: 140 triệu/tháng - giá bán 42 tỷ TL",42 tỷ,42.0,300 triệu/m²,140,N/A,"Đ. An Dương Vương, P. 3, Q. 5, Tp. Hồ Chí Minh",,,29/12/2025,https://meeyland.com/ban-nha-rieng-quan-5-ho-chi-minh-i1223/306304080,"Bán nhà mặt tiền An Dương Vương, Phường 3, Quận 5. - Diện tích 6,5x21m. - Kết cấu 1 hầm 7 tầng. - HĐT: 140 triệu/tháng. - Vị trí cực đẹp, ngay ngã tư Lê Hồng Phong và An Dương Vương. - Pháp lý đầy đủ. - Chủ nhà thiện chí bán. - Giá bán 42 tỷ thương lượng. - Liên hệ: 0939795588 em Kiều hỗ trợ xem nhà. Liên hệ: SĐT 1 093 979 **** Hiện số Thông tin chi tiết Mặt tiền 6,5m","6,5m",,,,,,
306306547,10,Nhà 4 tầng mới chăm phần chăm trung tâm quận 5 sát vách quận 1 chỉ hơn 6 tỏi tl.,"6,6 tỷ",6.6,"243,54 triệu/m²",27.1,N/A,"Đ. Lê Hồng Phong, P. 2, Q. 5, Tp. Hồ Chí Minh",3,3,29/12/2025,https://meeyland.com/ban-nha-rieng-quan-5-ho-chi-minh-i1223/306306547,"NHÀ 4 TẦNG MỚI CHĂM PHẦN CHĂM TRUNG TÂM QUẬN 5 SÁT VÁCH QUẬN 1 CHỈ 6,6 tỷ TL. Mô tả ngắn gọn: Nhà mới tinh, hoàn công đầy đủ, vào ở ngay Kết cấu: Trệt + 3 lầu + sân thượng 3 phòng ngủ 3 WC, sân thượng thoáng trồng cây thư giãn Hẻm trước nhà 3,5m, khu dân cư ổn định Vị trí cực tiện: Ngay trục Trần Hưng Đạo Nguyễn Trãi An Dương Vương Nguyễn Tri Phương Di chuyển nhanh Quận 1 Quận 10 Quận 3 Tiện ích xung quanh đầy đủ: Chợ Bến Thành Coopmart Cống Quỳnh BV Nhiệt Đới BV Chợ Rẫy TTTM An Đông Plaza Gần ngân hàng, UBND, khu vui chơi sinh hoạt cái gì cũng có Phù hợp ở gia đình trẻ hoặc mua giữ tài sản Trân Tròn Trịa ( nói ko với tin ảo) CẦN TÌM NHÀ TỐT, HÃY ĐẾN CHỐT CÙNG TRÂN. Thu gọn Liên hệ: SĐT 1 086 642 **** Hiện số Thông tin chi tiết Mặt tiền 3,2m","3,2m",,,,,,
306306511,10,"B.án nhà huỳnh mẫn đạt quận 5, dòng t.iền tốt chỉ 5.49 tỷ tl","5,49 tỷ",5.49,"167,38 triệu/m²",32.8,N/A,"Đ. Huỳnh Mẫn Đạt, P. 7, Q. 5, Tp. Hồ Chí Minh",3,3,29/12/2025,https://meeyland.com/ban-nha-rieng-quan-5-ho-chi-minh-i1223/306306511,"BÁN NHÀ HUỲNH MẪN ĐẠT QUẬN 5, DÒNG TIỀN TỐT CHỈ 5.49 TỶ TL Hẻm sạch thoáng, cách hẻm xe hơi chỉ vài căn đi lại cực kỳ tiện Nhà 3 tầng đang khai thác căn hộ dịch vụ có sẵn dòng tiền ~15 triệu /tháng Giá chào: 5.49 tỷ TL Tặng lại toàn bộ nội thất hiện hữu mua là khai thác ngay Thông tin chi tiết: Diện tích: 32.8m (3 x 14m), nở hậu 7m, vuông vức, không lỗi Kết cấu: 1 trệt + 2 lầu + sân thượng Công năng: 3 phòng ngủ 3 WC ban công rộng, thoáng Nhà đang cho th.uê ổn định, khách mua tiếp quản nhẹ nhàng Kết nối nhanh các trục đường lớn: Huỳnh Mẫn Đạt Nguyễn Văn Cừ Trần Hưng Đạo An Dương Vương Hồng Bàng Tiện ích xung quanh bán kính gần: Bệnh viện Đại học Y Dược TP.HCM Co.opmart Hùng Vương Đại học Sài Gòn Chợ An Đông Công viên Văn Lang Khu trung tâm Quận 5, nhu cầu thuê luôn cao, phù hợp ở kết hợp khai thác hoặc giữ tài sản lâu dài. Liên hệ: Trân Tròn Trịa ( nói ko với tin ảo) CẦN TÌM NHÀ TỐT, HÃY ĐẾN CHỐT CÙNG TRÂN. Thu gọn Liên hệ: SĐT 1 086 642 **** Hiện số Thông tin chi tiết Mặt tiền 3m Ưu điểm BĐS Đất vuông - nở hậu",3m,,,Đất vuông - nở hậu,,,
306306814,10,"Bán gấp nhà Trần Phú, Q5, giá 4,3 tỷ, 71.4m2 gần ngã 6 Cộng Hòa, đang còn HĐ thuê 25tr/tháng","4,2 tỷ",4.2,"bán gấp nhà trần phú, q5, giá 4,3 tỷ, 71.4m2 gần ngã 6 cộng hòa, đang còn hđ thuê 25tr/tháng",71.4,N/A,"P. 4, Q. 5, Tp. Hồ Chí Minh",3,3,29/12/2025,https://meeyland.com/ban-nha-rieng-quan-5-ho-chi-minh-i1223/306306814,"Vị trí: Đ. Trần Phú, Phường 4, Q5. Ngã 6 Cộng Hòa đi về Trần Phú 700m bên trái. + Căn nhà rộng 71.4m2 (4,6 x 16m). + Kết cấu: 1 trệt, 3 lầu, có sân thượng (3 phòng ngủ, 4 nhà vệ sinh). + Phù hợp với nhiều đối tượng khách hàng. + Tiện ích gần. - Trường Đại học Khoa học Tự nhiên - Đại học Quốc gia TP. HCM. - Ngã 6 Cộng Hòa. - Giáp Q1. Liên hệ để biết thông tin chi tiết qua điện thoại 0343207840 Liên hệ: SĐT 1 034 320 **** Hiện số Thông tin chi tiết Mặt tiền 4,6m","4,6m",,,,,,
306306803,10,"Cô Tú về quê ở cần bán nhà Nhiêu Tâm-P5-Q5, gần chợ Hoà Bình. Giá 3tỷ9/80m2 đang cho thuê 25trieu","3,9 tỷ",3.9,"cô tú về quê ở cần bán nhà nhiêu tâm-p5-q5, gần chợ hoà bình. giá 3tỷ9/80m2 đang cho thuê 25trieu",80,N/A,"Đ. Nhiêu Tâm, P. 5, Q. 5, Tp. Hồ Chí Minh",,,29/12/2025,https://meeyland.com/ban-nha-rieng-quan-5-ho-chi-minh-i1223/306306803,"Cô Tú về quê ở cần bán gấp nhà đang cho thuê 25 triệu/tháng - hợp đồng lâu dài. * Vị trí: Đường Nhiêu Tâm - Phường 5 - Quận 5, gần chợ Hoà Bình, bệnh viện Nhiệt Đới, khu dân trí cao. - Giá 3tỷ900. - Diện tích: 5m x 16m (80m2). - Kết cấu: 1 Trệt - 2 Lầu - sân thượng (đúc bê tông cốt thép). Gồm: 4 phòng ngủ - 5 nhà vệ sinh - phòng khách rộng,... - Sổ hoàn công đủ - sang tên liền. Liên hệ 0909508974 gặp em Trí để xem nhà trực tiếp (hỗ trợ miễn phí). Liên hệ: SĐT 1 090 950 **** Hiện số Thông tin chi tiết Ưu điểm BĐS Dân trí cao",,,,Dân trí cao,,,
306303511,10,"Nhà ngộp đường An Dương Vương, Quận 5, giá 3,9 tỷ, DT 60m2, còn HĐ thuê 30tr/tháng","3,9 tỷ",3.9,"nhà ngộp đường an dương vương, quận 5, giá 3,9 tỷ, dt 60m2, còn hđ thuê 30tr/tháng",60,N/A,"Đ. An Dương Vương, P. 4, Q. 5, Tp. Hồ Chí Minh",4,4,29/12/2025,https://meeyland.com/ban-nha-rieng-quan-5-ho-chi-minh-i1223/306303511,"Vị trí: An Dương Vương, phường 4, Quận 5, Giao lộ Lê Hồng Phong - An Dương Vương đi thẳng 300m bên phải. - DT: 60m2 (ngang 4m x 15m). - Kết cấu: 1 trệt, 3 lầu, có sân thượng (4 phòng ngủ, 5 nhà vệ sinh. - (không phát sinh thêm chi phí). - Tiện ích: + Bệnh viện Chợ Rẫy (13 phút đi xe). + Chợ An Đông (4 phút đi xe). + Trường Đại học Sài Gòn (2 phút đi xe). Mua nhà tặng nội thất. Hẻm trước nhà thông 6m, cách mặt tiền đường 10m. Sổ hồng đứng tên chính chủ. Giá còn thương lượng. Liên hiện: 0343207840 để hẹn gặp và thương lượng trực tiếp với chủ. Thu gọn Liên hệ: SĐT 1 034 320 **** Hiện số Thông tin chi tiết Mặt tiền 4m",4m,,,,,,
306306776,10,"Hàng hiếm tại giá cực sốc giá 3TỶ215 Nguyễn Trãi, Quận 5, Hồ Chí Minh, nhà vuông vức 46,5 m2","3,22 tỷ",3.22,"69,25 triệu/m²",46.5,N/A,"Đ. Nguyễn Trãi, P. 7, Q. 5, Tp. Hồ Chí Minh",2,2,29/12/2025,https://meeyland.com/ban-nha-rieng-quan-5-ho-chi-minh-i1223/306306776,"Hàng hiếm hàng hiếm gọi liền cho em 0909440856 - Tấn Phát nha cô chú anh chị mình ơi. - 2PN, 2WC, thiết kế thông minh, tiện nghi. - Nội thất đầy đủ: Điều hòa, tủ lạnh, giường... - Ngõ trước rộng 5m, thuận tiện cho việc di chuyển. - Pháp lý đầy đủ. Tiện ích xung quanh: - Công viên Hòa Bình, Công viên Võ Văn Kiệt. - Siêu thị SatraMart, Siêu thị Mẹ Bầu & Em Bé Con Cưng. - Trung tâm tiếng Trung Hoa Văn Thương Mại Thành Phố 2. - Bệnh viện Nguyễn Tri Phương, Bệnh viện Chợ Rẫy, Bệnh viện Bệnh Nhiệt Đới. Liên hệ ngay Trần Tấn Phát tại 0909440856 để biết thêm chi tiết. Thu gọn Liên hệ: SĐT 1 090 944 **** Hiện số",,,,,,,
306305771,10,"Sốc!!! Chỉ với 4tỷ6 sở hữu nhà Cao Đạt P1 Q5 gần CĐ Kinh tế đối ngoại, cho thuê 25tr/th DT 90m2","4,6 tỷ",4.6,"sốc!!! chỉ với 4tỷ6 sở hữu nhà cao đạt p1 q5 gần cđ kinh tế đối ngoại, cho thuê 25tr/th dt 90m2",90,N/A,"Đ. Cao Đạt, P. 1, Q. 5, Tp. Hồ Chí Minh",5,5,29/12/2025,https://meeyland.com/ban-nha-rieng-quan-5-ho-chi-minh-i1223/306305771,"Sở hữu ngay nhà đường Cao Đạt, phường 1, Quận 5, hần Trường Cao đẳng Kinh tế đối ngoại. Diện tích 90m2 (5x18m). Nhà 1 trệt 2 lầu 5 phòng ngủ 5 nhà vệ sinh sân thượng. Nội thất đầy đủ như sofa, tivi, tủ lạnh, điều hòa,... Mua nhà được tặng toàn bộ nội thất. Hiện cho thuê 25 triệu/tháng. Giá 4tỷ6 Nhà năm gần Trường Cao đẳng Kinh tế đối ngoại, cách quận 1 tầm 3 phút di chuyển. Pháp lý sổ hồng chính chủ. Muốn xem nhà liên hệ 0778037508 gặp An. Liên hệ: SĐT 1 077 803 **** Hiện số",,,,,,,
306306126,10,Siêu phẩm - mặt tiền nguyễn trãi - nhà 7 tầng có thang máy - đang cho thuê ~400t.r/năm - hiếm bán,"23,2 tỷ",23.2,"539,53 triệu/m²",43,N/A,"P. 11, Q. 5, Tp. Hồ Chí Minh",,,29/12/2025,https://meeyland.com/ban-nha-rieng-quan-5-ho-chi-minh-i1223/306306126,"- DT: 43m2 | 1 trệt - 6 lầu | sổ hồng riêng - Vị trí: mặt tiền Nguyễn Trãi, gần trường ĐH Hùng Vương, bệnh viện, chợ Lớn,.. đầy đủ tiện ích - Pháp lý sạch, sổ hồng vuông vức, gửi bank giữ hộ Liên hệ: SĐT 1 077 767 **** Hiện số",,,,,,,
306302258,10,Bán Nhà Siêu Vị Trí Mặt Tiền Nguyễn Trãi - Quận 5 - (5x22m) - 5 Tầng - HĐT: 190TR/Tháng - Giá 45 Tỷ,45 tỷ,45.0,"409,09 triệu/m²",110,N/A,"Đ. Nguyễn Trãi, P. 3, Q. 5, Tp. Hồ Chí Minh",,,29/12/2025,https://meeyland.com/ban-nha-rieng-quan-5-ho-chi-minh-i1223/306302258,"Bán nhà siêu vị trí mặt tiền đường Nguyễn Trãi. Phường 3. Quận 5 - Diện tích: 5 x 22m - Kết cấu: 5 Tầng - Siêu vị trí, tuyến đường thương hiệu - Khu vực chuyên Thời Trang sầm uất - Bề ngang 5m khan hiếm - Phù hợp kinh doanh nhiều ngành nghề hoặc cho thuê Thương Hiệu thuê giữ tiền hàng tháng - Hợp đồng thuê: 190TR/Tháng - Giá: 45 Tỷ - Liên hệ: 0908981009 Duy Anh - Chuyên viên tư vấn pháp lý và đầu tư BĐS Hàng Hiệu tại trung tâm TP. Hồ Chí Minh Liên hệ: SĐT 1 090 898 **** Hiện số",,,,,,,
306306465,10,"Quận 5 cc xóm cải 2pn lầu 1 shr giá 2,6tỷ","2,6 tỷ",2.6,"60,47 triệu/m²",43,N/A,"Đ. Nguyễn Trãi, P. 8, Q. 5, Tp. Hồ Chí Minh",5,2,29/12/2025,https://meeyland.com/ban-can-ho-chung-cu-quan-5-ho-chi-minh-i1423/306306465,"#1088 - Nguyễn Trãi Giá bán: 2,6Tỷ Diện tích: 43m2 ( 7m x 6,5m ) 2PN, 1WC, Nhà bếp, Phòng khách, Ban công Tiện ích: Thông ra các trục đường lớn Nguyễn Trãi, Ngô Quyền, Mạc Thiên Tích Sổ Hồng riêng Lâu dài , Công chứng nhanh Anh chị quan tâm liên hệ: 0792079802có Zalo) Ms. Quỳnh. Để được xem nhà miễn phí và trực tiếp đàm phán chính chủ. Liên hệ: SĐT 1 079 207 **** Hiện số",,,,,,,
306302467,10,"Chủ ngộp bán nhà 2 tỷ 6, đường huỳnh mẫn đạt, p.7, q.5, 90m2, ( 6 x15 ) hđ thuê 23tr/th, có sổ hồng","2,6 tỷ",2.6,"chủ ngộp bán nhà 2 tỷ 6, đường huỳnh mẫn đạt, p.7, q.5, 90m2, ( 6 x15 ) hđ thuê 23tr/th, có sổ hồng",90,N/A,"Đ. Huỳnh Mẫn Đạt, P. 7, Q. 5, Tp. Hồ Chí Minh",3,3,28/12/2025,https://meeyland.com/ban-nha-rieng-quan-5-ho-chi-minh-i1223/306302467,"Bán nhà mặt đường Huỳnh Mẫn Đạt, Phường 7, Quận 5, 2 tỷ 600 triệu bao sang tên. Diện tích: 90 m² (ngang 6,15m) Kết cấu: Nhà được thiết kế 1 trệt, 1 lửng, 2 lầu, 3 phòng ngủ, 4 phòng vệ sinh. Pháp lý: Sổ hồng riêng, sang tên ngay Hợp đồng thuê: 23 triệu/tháng thu nhập ổn định, phù hợp đầu tư Giá bán: 2 tỷ 6 (thương lượng nhẹ) Tiện ích xung quanh: Khu trung tâm Quận 5, gần chợ, trường học, bệnh viện và khu ăn uống nổi tiếng Giao thông thuận tiện, dân cư đông đúc, an ninh tốt Thích hợp để ở, cho thuê hoặc kinh doanh Liên hệ ngay: Số điện thoại em Ngọc Phúc 0938924583 để xem nhà Thu gọn Liên hệ: SĐT 1 093 892 **** Hiện số Thông tin chi tiết Mặt tiền 8m Ưu điểm BĐS Giao thông thuận lợi",8m,,,Giao thông thuận lợi,,,
306303153,10,"Quận 5 cao đạt , ngang 9m,thang máy, dt 135m 8 tầng giá 48 tỷ",48 tỷ,48.0,"355,56 triệu/m²",135,N/A,"Đ. Cao Đạt, P. 2, Q. 5, Tp. Hồ Chí Minh",3,,28/12/2025,https://meeyland.com/ban-nha-rieng-quan-5-ho-chi-minh-i1223/306303153,"QUẬN 5 CAO ĐẠT NGANG 9M DT 135M 8 TẦNG GIÁ 48 TỶ Vị trí: Đường Cao Đạt, Quận 5. Sát Quận 1, khu kinh doanh sầm uất, lưu thông đông đúc. Diện tích: 135m (ngang 9m, dài 15m). Kết cấu: 1 trệt, 1 lửng, 6 lầu, sân thượng, thang máy. Công năng: 3 phòng ngủ, 8 WC, thiết kế thông sàn. Ưu điểm: Mặt tiền đường 12m, ngang lớn 9m, nhà đẹp, khai thác tốt. Phù hợp: Văn phòng công ty, spa, phòng khám, nha khoa, kinh doanh đa ngành. Giá bán: 48 tỷ (thương lượng) Pháp lý: Sổ hồng riêng. Liên hệ xem nhà: Chị Thảo Anh Nhẫn Thu gọn Liên hệ: SĐT 1 076 822 **** Hiện số Thông tin chi tiết Mặt tiền 9m Tiện ích Thang máy",9m,,,,,,Thang máy
306303753,10,"Mặt tiền, Quận 5, Đại học Sư Phạm, Sài Gòn, Khoa học tự nhiên, vị trí VIP, 7 tầng, thang máy, 37 tỷ",37 tỷ,37.0,"462,5 triệu/m²",80,N/A,"Đ. An Dương Vương, P. 2, Q. 5, Tp. Hồ Chí Minh",,,28/12/2025,https://meeyland.com/ban-nha-rieng-quan-5-ho-chi-minh-i1223/306303753,"Mô tả: - Diện tích: 4x20. Công nhận đủ, - Kết cấu: 7 tầng thang máy. PCCC đầy đủ. - Vị trí cực đẹp, sang nhất của đường An Dương Vương, khu vực tập trung nhiều Tòa nhà Căn Phòng, Ngân hàng, Nhà Hàng, gần trường Đại Học Sài Gòn và ĐH Sư Phạm. - Thích hợp để ở kinh doanh hoặc làm văn phòng cty, showroom, thẩm mỹ viện. Giao thông thuận tiện đi lại Quận 1,3,10. + Pháp Lý: Sổ hồng, công chứng ngay Liên hệ: SĐT 1 039 892 **** Hiện số Thông tin chi tiết Mặt tiền 4m Tiện ích Thang máy Ưu điểm BĐS Giao thông thuận lợi",4m,,,Giao thông thuận lợi,,,Thang máy
306306624,10,Nhà Hồng Bàng Giáp Q5 - 5Tầng Ngang 4.1 Dài 16 Vuông Vức - Mới Xây -Giá Chỉ Hơn 20 Tỷ,22 tỷ,22.0,"338,46 triệu/m²",65,N/A,"Đ. Hồng Bàng, P. 14, Q. 5, Tp. Hồ Chí Minh",,,28/12/2025,https://meeyland.com/ban-nha-rieng-quan-5-ho-chi-minh-i1223/306306624,"- Vị trí ngay đoạn Kinh Doanh nhộn nhịp nhất con đường Hồng Bàng - Nguyễn Thị nhỏ - Mặt tiền Hồng Bàng hiếm nhà bán không lỗi phong thuỷ - Nhà 5 tầng, trệt mặt bằng kinh doanh, tầng 1 bếp + PK, tầng 2,3, gồm 4PN + 5WC, tầng 4 PT, sân phơi, mái bê tông. - Gọi em gấp để em hẹn chủ cho Quý Khách xem trong nhà Liên hệ: SĐT 1 093 809 **** Hiện số Thông tin chi tiết Mặt tiền 4,1m","4,1m",,,,,,
306305337,10,"Siêu phẩm rẻ nhất chỉ có ở An Dương Vương p2 Q5. Giá 4,7tỷ/77,4m2 cách bệnh viện Hùng Vương 5 phút.","4,7 tỷ",4.7,"siêu phẩm rẻ nhất chỉ có ở an dương vương p2 q5. giá 4,7tỷ/77,4m2 cách bệnh viện hùng vương 5 phút.",77.4,N/A,"Đ. An Dương Vương, P. 2, Q. 5, Tp. Hồ Chí Minh",4,4,28/12/2025,https://meeyland.com/ban-nha-rieng-quan-5-ho-chi-minh-i1223/306305337,"Vị trí: Đường An Dương Vương, phường 2. Quận 5 gần Bệnh Viện Hùng Vương, Trường Mầm Non Hoa Mị - Đại Học Sài Gòn, ĐH Khoa Học Tự Nhiên, Chợ An Đông, Bệnh Viện Quân Y 7A, Co.op Mart Hùng Vương. + Diện tích: 77,4m2 ( 4,3m x 18m ) + Giá: 4 tỷ 700 Triệu ( còn thương lượng ) + Kết cấu: 1 trệt, 3 lầu, 4 phòng ngủ, 5 nhà vệ sinh, sân thượng, phòng thờ Hẻm ô tô 5m thông, thích hợp cho gia đình ở và kết hợp kinh doanh, mở văn phòng, spa. vv.. Sổ Hồng Đứng Tên Chủ, Hoàn Công Đầy Đủ *+* Liên hệ: 0973862351 Mây - Để em hỗ trợ mình gặp trực tiếp chủ thương lượng. Thu gọn Liên hệ: SĐT 1 097 386 **** Hiện số Thông tin chi tiết Mặt tiền 5m",5m,,,,,,
306305083,10,Siêu phẩm - nhà 5 tầng có thang máy - ngang khủng ~8m - nội thất cao cấp - xe hơi ngủ trong nhà,"19,5 tỷ",19.5,"237,52 triệu/m²",82.1,N/A,"P. 5, Q. 5, Tp. Hồ Chí Minh",5,,28/12/2025,https://meeyland.com/ban-nha-rieng-quan-5-ho-chi-minh-i1223/306305083,"- DT: 82,1m2 | ngang 7.6m | 1 trệt - 3 lầu - 1 sân thượng | sổ riêng - Đường trước nhà 10m thông thoáng, xe hơi đổ tận cửa - Vị trí: sát mặt tiền Võ Văn Kiệt, gần chợ, trường học, Công an TP,...tiện ích không thiếu gì Liên hệ: SĐT 1 077 767 **** Hiện số",,,,,,,
306303873,11,"Bán toà nhà mặt tiền đường Nguyễn Biểu - Trần Hưng Đạo, Q5, giáp Q1, cách chợ Bến Thành 1km",250 tỷ,250.0,"739,64 triệu/m²",338,N/A,"Đ. Nguyễn Biểu, P. 1, Q. 5, Tp. Hồ Chí Minh",,,28/12/2025,https://meeyland.com/ban-nha-rieng-quan-5-ho-chi-minh-i1223/306303873,"- BÁN BUILDING TRUNG TÂM QUẬN 5 NGUYỄN BIỂU, HẦM + 9 TẦNG | DÒNG TIỀN CAO Địa chỉ: 62- 64 Nguyễn Biểu, Phường 1, Quận 5, TP.HCM - Diện tích đất: 11,3m x 30m - Diện tích công nhận: 338,06 m - Diện tích sàn: 2.509,51 m - Kết cấu: 1 hầm + 9 tầng - Hợp đồng thuê: 700 triệu/tháng dài hạn, dòng tiền ổn định - Ưu điểm nổi bật: + Building quy mô lớn, mặt tiền đôi hiếm tại Quận 5 + Có hầm xe, thang máy, thiết kế chuẩn khai thác thương mại + Phù hợp văn phòng công ty lớn, ngân hàng, trung tâm đào tạo, phòng khám, thẩm mỹ viện, khách sạn căn hộ dịch vụ + Khu vực kinh doanh sầm uất, thanh khoản tốt, giá trị tăng trưởng bền vững - Pháp lý: Sổ hồng chính chủ - Giá bán: 250 tỷ (thương lượng cho khách thiện chí) Liên hệ: 0333336153 Em Bình Thu gọn Liên hệ: SĐT 1 033 333 **** Hiện số Thông tin chi tiết Mặt tiền 12m Tiện ích Thang máy",12m,,,,,,Thang máy
306305705,11,"Giá chỉ 3Tỷ590/78,5M2 sở hữu nhà, đường 6m An Dương Vương-Q.5, đang cho thuê 23tr, gần Chợ Hoà Bình","3,59 tỷ",3.59,"giá chỉ 3tỷ590/78,5m2 sở hữu nhà, đường 6m an dương vương-q.5, đang cho thuê 23tr, gần chợ hoà bình",78.5,N/A,"Đ. An Dương Vương, P. 4, Q. 5, Tp. Hồ Chí Minh",4,4,28/12/2025,https://meeyland.com/ban-nha-rieng-quan-5-ho-chi-minh-i1223/306305705,"Chính chủ để lại căn nhà ngộp đường ô tô thoải mái 6m, đã hoàn công, đang sẵn dòng tiền 23 triệu/tháng. * Vị trí: Đường An Dương Vương - Phường 4 - Quận 5, gần Chợ An Đông, bệnh viện Nguyễn Trãi, đại học Sài Gòn. Giá 3Tỷ590 thương lượng thêm - Diện tích: 78,5m2 (6,5m x 12,1m). - Kết cấu: 1 trệt - 3 lầu - giếng trời lấy sáng. - Công năng nhà có 4 phòng ngủ - 5 nhà vệ sinh - nội thất cơ bản. - Nội thất đầy đủ tiện nghi. - Sổ hồng riêng chính chủ - sang tên nhanh trong ngày. Gọi ngay 0947407203 Tiến làm việc trực tiếp, hỗ trợ miễn phí. Thu gọn Liên hệ: SĐT 1 094 740 **** Hiện số",,,,,,,
306300327,11,Quận 5 - Huỳnh Mẫn Đạt - diện tích khủng 54.65m2 - chỉ 5.25 tỷ,"5,25 tỷ",5.25,"96,07 triệu/m²",54.65,N/A,"Đ. Huỳnh Mẫn Đạt, P. 7, Q. 5, Tp. Hồ Chí Minh",3,3,28/12/2025,https://meeyland.com/ban-nha-rieng-quan-5-ho-chi-minh-i1223/306300327,"Quận 5 - Huỳnh Mẫn Đạt - diện tích khủng 54.65m2 - chỉ 5.25 tỷ. Vị trí: Huỳnh Mẫn Đạt, P. 7, Quận 5 Khu vực sầm uất, giáp ranh Quận 1. Diện tích: 54.65m2 thông số cực đẹp, nở hậu tài lộc. Kết cấu: Hiện trạng nhà tiện cải tạo hoặc xây mới, hẻm an ninh, sạch sẽ. Ưu điểm: Đơn giá chỉ 96tr/m2 mức giá rẻ nhất khu vực Quận 5 cho diện tích lớn. Liên hệ Nguyên Võ 0909845033 để xem thực tế và chốt ngay siêu phẩm! Liên hệ: SĐT 1 090 984 **** Hiện số Thông tin chi tiết Mặt tiền 3m Hướng ban công Đông Bắc Ưu điểm BĐS Đất vuông - nở hậu, Xây mới",3m,,,"Đất vuông - nở hậu, Xây mới",,Đông Bắc,
306306006,11,Quận 5 ô tô đỗ cửa nhà ngang 4.8m_4 lầu 57m2 chỉ hơn 8 tỷ.,N/A,,N/A,57,N/A,"P. 7, Q. 5, Tp. Hồ Chí Minh",,,28/12/2025,https://meeyland.com/ban-nha-rieng-quan-5-ho-chi-minh-i1223/306306006,"Kết cấu: 1 trệt 1 lửng 1 lầu và sân thượng - Tổng 4PN 1 Phòng thờ, 1 phòng kho nhỏ - 1 sân thượng. + 2 mặt tiền hẻm thông thoáng ô tô đỗ cửa. + Chính chủ 1 đời cần bán - Nhà chủ đang cho thuê 16tr/tháng giữ nhà. Xem nhà liên hệ: Phúc 0906337690 Liên hệ: SĐT 1 090 633 **** Hiện số",,,,,,,
306306562,11,"Bán căn hộ chung cư Thuận Kiều Plaza Quận 5, Hồ Chí Minh",N/A,,N/A,,N/A,Căn hộ chung cư,,,N/A,https://meeyland.com/ban-can-ho-chung-cu-quan-5-ho-chi-minh-i1423/306306562,N/A,,,,,,,
306302228,11,"Bán nhà mặt tiền An Dương Vương,Quận 5, đường 30m, 7 tầng có Thang Máy, DT:4x20,Giá: 37 Tỷ",37 tỷ,37.0,"462,5 triệu/m²",80,N/A,"Đ. An Dương Vương, P. 8, Q. 5, Tp. Hồ Chí Minh",,,28/12/2025,https://meeyland.com/ban-nha-rieng-quan-5-ho-chi-minh-i1223/306302228,"** Vị trí cực đẹp, sang nhất của đường An Dương Vương, khu vực tập trung nhiều Tòa nhà Căn Phòng, Ngân hàng, Nhà Hàng, gần trường Đại Học Sài Gòn và ĐH Sư Phạm. - Diện tích: 4x20. Công nhận đủ. - Kết cấu: 7 tầng thang máy. - PCCC đầy đủ. - Thích hợp để ở kinh doanh hoặc làm văn phòng cty, showroom, thẩm mỹ viện. Giao thông thuận tiện đi lại Quận 1,3,10.,, ** Pháp Lý: Sổ hồng, công chứng ngay. $$ Giá : 37 Tỷ Liên Hệ : 0932940748 Thấm Liên hệ: SĐT 1 093 294 **** Hiện số Thông tin chi tiết Mặt tiền 4m Tiện ích Thang máy Ưu điểm BĐS Giao thông thuận lợi",4m,,,Giao thông thuận lợi,,,Thang máy
306303644,11,"Chuyển công tác, Ngô Quyền, P5, Q5, DT 78m2, giá 3tỷ590 cho thuê 25 triệu, sổ hồng riêng chính chủ","3,59 tỷ",3.59,"46,03 triệu/m²",78,N/A,"Đ. Ngô Quyền, P. 5, Q. 5, Tp. Hồ Chí Minh",4,4,28/12/2025,https://meeyland.com/ban-nha-rieng-quan-5-ho-chi-minh-i1223/306303644,"Nhà đẹp chính chủ chuyển công tác cần bán gấp đường Ngô Quyền, Phường 5, Quận 5, TP. HCM. Thông tin chi tiết: - Giá bán : 3tỷ590 đang cho thuê 25 triệu/tháng (hợp đồng ổn định khách thuê lâu dài). - Diện tích: 78m2 (ngang 5m x dài 15,6m). - Kết cấu: 1 trệt, 1 lửng, 3 lầu, 4 phòng ngủ, 5WC, sân thượng trước sau, gara ô tô, phòng thờ, phòng giặt, full nội thất cao cấp. * Vị trí cực kỳ đắc địa ngay trung tâm Quận 5 gần chợ Kim Biên, Đại học Y Dược, bệnh viện Nguyễn Tri Phương, thuận tiện sinh hoạt và di chuyển. Nhà xây kiên cố bê tông cốt thép (BTCT) thiết kế sang trọng, hiện đại, nội thất cao cấp từng chi tiết. Phù hợp để ở, mở văn phòng công ty, cho thuê căn hộ dịch vụ hoặc đầu tư sinh lời lâu dài. Không gian sống thoáng đãng, có sân thượng trước sau lý tưởng để thư giãn, trồng cây xanh. * Pháp lý rõ ràng: Sổ hồng riêng chính chủ, hoàn công đầy đủ hỗ trợ vay ngân hàng nếu có nhu cầu. - Gọi cho tôi: 0914875689Sinh) xem nhà. Thu gọn Liên hệ: SĐT 1 091 487 **** Hiện số Thông tin chi tiết Mặt tiền 5m",5m,,,,,,
