306280861,14,"Nhà đẹp quận 5, cao đạt, p1, full nội thất, sổ hồng riêng, giá 5,78 tỷ tl. liên hệ 0876410777","5,78 tỷ",5.78,"275,24 triệu/m²",21,N/A,"Đ. Cao Đạt, P. 1, Q. 5, Tp. Hồ Chí Minh",,,25/12/2025,https://meeyland.com/ban-nha-rieng-quan-5-ho-chi-minh-i1223/306280861,"NHÀ ĐẸP TRUNG TÂM QUẬN 5 VÀO Ở NGAY Giá chỉ 5,78 TỶ Thương lượng lộc Địa chỉ: 197/ Cao Đạt, Phường 1, Quận 5 Khu dân cư an ninh, trung tâm tiện ích bủa vây Diện tích: Công nhận: 21m² (3m x gần 9m) Diện tích sử dụng thực tế ~24m² Kết cấu: 1 Trệt + 2 Lầu BTCT kiên cố, lấn ban công rộng rãi Ưu điểm nổi bật: Nhà đẹp cứng cáp vào ở ngay Tặng full nội thất (chỉ xách vali về ở) Phù hợp ở gia đình nhỏ, cho thuê, đầu tư giữ tiền Pháp lý: Sổ hồng chính chủ Công chứng sang tên nhanh gọn Giá cực tốt chỉ 5,78 tỷ còn thương lượng cho khách thiện chí Inbox / Gọi ngay: 0876410777 Vũ Anh - chuyên nhà đẹp HCM Thu gọn Liên hệ: SĐT 1 087 641 **** Hiện số",,,,,,,
306280925,15,"Nguyễn Trãi, Q5 giáp Q1 - 2 Tầng - 56m2 - ngang khủng hơn 6m... 7.99 tỷ","7,99 tỷ",7.99,"142,68 triệu/m²",56,N/A,"Đ. Nguyễn Trãi, P. 2, Q. 5, Tp. Hồ Chí Minh",2,2,25/12/2025,https://meeyland.com/ban-nha-rieng-quan-5-ho-chi-minh-i1223/306280925,"Vị trí: Nằm gần Đường Nguyễn Trãi, Nguyễn Văn Cừ, di chuyển qua quận trung tâm chỉ 5p. Mô tả: + Kết cấu: 1 trệt 1 lầu, 2 phòng ngủ, 2WC, ban công thoáng mát, sân để xe. + Hẻm an ninh sạch sẽ, hẻm thông, giáp Q1. + Hướng Đông. + Sổ hồng riêng hoàn công. - Gọi ngay 0978150481 gặp Hùng xem nhà. Liên hệ: SĐT 1 097 815 **** Hiện số Thông tin chi tiết Mặt tiền 6m",6m,,,,,,
306285004,15,"Bán nhà mặt tiền tại Nguyễn Trãi, 26 tỷ, 75m2, 4PN, 3WC, đẹp cực chất",26 tỷ,26.0,"346,67 triệu/m²",75,N/A,"Đ. Nguyễn Trãi, P. 7, Q. 5, Tp. Hồ Chí Minh",26,26,25/12/2025,https://meeyland.com/ban-nha-rieng-quan-5-ho-chi-minh-i1223/306285004,"Ngôi nhà mặt phố này tọa lạc tại đường Nguyễn Trãi, p7, Q5, HCM, với diện tích 75m2. Thiết kế 3 tầng, 4PN, 3WC, nội thất cơ bản, rất phù hợp cho những ai muốn tìm kiếm không gian sống lý tưởng cũng như mặt bằng kinh doanh. Mặt tiền rộng 3.95m, dễ dàng thu hút khách hàng nếu muốn mở shop hay quán cà phê. Pháp lý đầy đủ, đảm bảo an tâm cho người mua. + Diện tích: 75m2 + Giá: 26 tỷ VND + 4PN, 3WC + Mặt tiền 3.95m + Nội thất cơ bản Khu vực xung quanh + Bệnh viện Nguyễn Tri Phương, Bệnh viện Chợ Rẫy + Công viên Hòa Bình, Công viên Võ Văn Kiệt + Trung tâm tiếng Trung Hoa Văn Thương Mại TP.HCM + Siêu thị Satramart, Siêu thị Mẹ Bầu & Em Bé Con Cưng Liên hệ ngay để biết thêm chi tiết! Miêng Trường: 0983307080 Thu gọn Liên hệ: SĐT 1 098 330 **** Hiện số Thông tin chi tiết Mặt tiền 3,95m Ưu điểm BĐS Mặt tiền rộng","3,95m",,,Mặt tiền rộng,,,
306287088,15,"Bán Nhà Đường Nội Bộ 10m Bạch Vân, 77m2(4.5x17) 4 Tầng 5Pn, P. An Đông Quận 5, Giá 19 Tỷ",19 tỷ,19.0,"248,37 triệu/m²",76.5,N/A,"Đ. Bạch Vân, P. 5, Q. 5, Tp. Hồ Chí Minh",10,,25/12/2025,https://meeyland.com/ban-nha-rieng-quan-5-ho-chi-minh-i1223/306287088,"BÁN NHÀ 4 TẦNG ĐƯỜNG 10M, XE HƠI QUAY ĐẦU - Trân Tuấn Khải-Bạch Vân Quận 5 - Giá 19 Tỷ Diện tích: 4.5 m 17 m vuông đẹp Kết cấu: 4 tầng 5 phòng ngủ + sân thượng rộng thoáng Phù hợp: Ở gia đình Khai thác Khách sạn / CHDV (căn hộ dịch vụ) Mở văn phòng công ty / office Đường trước nhà: 10m, xe hơi quay đầu dễ dàng cực tiện đi lại & kinh doanh. Gần các trục đường lớn như An Bình, Võ Văn Kiệt, Trần Hưng Đại, Nguyễn Trãi.... Pháp lý: Sổ riêng chính chủ Pháp lý chuẩn, sang tên ngay thủ tục nhanh gọn Liên hệ xem nhà: [Dương Hoàng Anh / 0398580708 / Zalo] Thu gọn Liên hệ: SĐT 1 039 858 **** Hiện số",,,,,,,
306260715,15,Bán nhà mặt tiền Trần Phú - P.4 - Quận 5 - DT 3.7x11m - 4 tầng - giá 13.5 tỷ,"13,5 tỷ",13.5,"354,33 triệu/m²",38.1,N/A,"P. 4, Q. 5, Tp. Hồ Chí Minh",,,25/12/2025,https://meeyland.com/ban-nha-rieng-quan-5-ho-chi-minh-i1223/306260715,"Bán nhà Mặt Tiền đường Trần Phú, Phường 4, Quận 5 - Nay là Phường Chợ Quán. - DT: 3.7x11m. - Kết cấu: 1 trệt 2 lầu sân thượng. - Vị trí: Đoạn sung - Kinh doanh sầm uất - dễ dàng cho thuê văn phòng hoặc buôn bán. - Giá: 13.5 tỷ. Liên hệ: Miss Hồng Minh. (24/7). (MTG0908315979 Liên hệ: SĐT 1 090 831 **** Hiện số Thông tin chi tiết Mặt tiền 3,7m","3,7m",,,,,,
306282520,15,"Bán nhà 4 tầng nguyễn văn cừ, quận 5 dt 55m chỉ 9,7 tỷ (tl)","9,7 tỷ",9.7,"179,63 triệu/m²",54,N/A,"Đ. Nguyễn Văn Cừ, P. 1, Q. 5, Tp. Hồ Chí Minh",5,5,25/12/2025,https://meeyland.com/ban-nha-rieng-quan-5-ho-chi-minh-i1223/306282520,"* Vị trí: trung tâm hiếm có Quận 5, tọa lạc tại hẻm Nguyễn Văn Cừ, P.1, Q.5, chỉ 20 m ra đường lớn, xe hơi vào tận nơi. Kết nối cực nhanh Trần Hưng Đạo Võ Văn Kiệt Quận 1 Quận 10, giao thông thuận tiện mọi hướng. * Thông tin tài sản: - Diện tích: 55m² (5m x 11m) - Kết cấu: 1 trệt + 2 lầu + sân thượng - 5PN (có phòng ngủ tầng trệt rất tiện cho người lớn tuổi), 4 WC, Phòng khách bếp ban công thoáng mát - Nhà xây kiên cố, khu dân cư ổn định, an ninh tốt - Pháp lý: Sổ hồng riêng chính chủ, công chứng nhanh gọn. * Giá trị khai thác: - Vị trí đắc địa: sát Quận 1, gần cầu Nguyễn Văn Cừ, - Hẻm rộng, gần mặt tiền, xe hơi vào nhà - Thích hợp mở văn phòng, phòng khám, cho thuê, đầu tư tích luỹ tài sản. - Giá tốt trong khu vực phù hợp ở gia đình nhỏ, mua tích sản hoặc cho thuê * Giá bán: 9,7 tỷ (TL cho khách thiện chí) * ACE quan tâm vui lòng liên hệ theo thông tin bên dưới: --- Ms Hồng 0909814899 - chuyên BĐS Nhà Phố trung tâm - Đúng nhà , Đúng giá --- Thu gọn Liên hệ: SĐT 1 090 981 **** Hiện số Thông tin chi tiết Ưu điểm BĐS Giao thông thuận lợi",,,,Giao thông thuận lợi,,,
306282796,15,Giảm Sốc 2.4 Tỷ - MT Châu Văn Liêm 5.2x20m CN 101m2 - 2 Tầng - HĐT 55 Tr/tháng - Bán 45.6 Tỷ,"45,6 tỷ",45.6,giảm sốc 2.4 tỷ - mt châu văn liêm 5.2x20m cn 101m2 - 2 tầng - hđt 55 tr/tháng - bán 45.6 tỷ,101,N/A,"Đ. Châu Văn Liêm, P. 10, Q. 5, Tp. Hồ Chí Minh",,,25/12/2025,https://meeyland.com/ban-nha-rieng-quan-5-ho-chi-minh-i1223/306282796,"Chủ cần CHỦ CẦN XỬ LÝ VIỆC CÁ NHÂN GẤP, chấp nhận giảm tổng cộng 2.4 Tỷ (tương đương 5%) trên giá 48 Tỷ cho khách thiện chí giao dịch nhanh. Vị trí Độc Tôn: Nhà Mặt tiền đường Châu Văn Liêm, Phường 10, Quận 5. Ngay khu Hải Thượng Lãn Ông. Quy mô: Diện tích 5.23m x 20m. Công nhận 101m². Kết cấu: 2 Tầng. Dòng tiền Ổn Định: Đang cho Nha khoa thuê 55 Triệu/tháng. Hợp đồng còn 10 năm, mỗi năm tăng 15%. Giá Bán Nhanh: 45.6 Tỷ VNĐ (Giá chốt cuối). Liên hệ: SĐT 1 090 348 **** Hiện số",,,,,,,
306285181,15,"Bán Nhà Riêng đường An Dương Vương-Q.5, giá 3Tỷ590/74,3m2. Đang cho thuê 22tr, gần Đại Học Sài Gòn.","3,59 tỷ",3.59,"bán nhà riêng đường an dương vương-q.5, giá 3tỷ590/74,3m2. đang cho thuê 22tr, gần đại học sài gòn.",74.3,N/A,"Đ. An Dương Vương, P. 4, Q. 5, Tp. Hồ Chí Minh",4,4,25/12/2025,https://meeyland.com/ban-nha-rieng-quan-5-ho-chi-minh-i1223/306285181,"CHÍNH CHỦ bán nhà riêng 2 tầng, diện tích 74.3m2( ngang 4,2 x dài 17,7m ). Đường An Dương Vương - Phường 4 - Quận 5. - Giá đầu tư 3Tỷ590 ( còn thương lượng ): + Sẵn hợp đồng cho thuê 22 triệu/tháng + Gồm 4 phòng ngủ - 4 nhà vệ sinh, không gian rộng rãi, thoáng đãng. + Nội thất cơ bản bao gồm điều hòa, tủ lạnh,... - Khu vực xung quanh: + Cách công viên Hòa Bình và công viên Âu Lạc chỉ 2km. + Gần siêu thị Mẹ Bầu & Em Bé Con Cưng, WinMart+, thuận tiện cho việc mua sắm. + Đại học Sài Gòn cách 200m. Liên hệ ngay để được tư vấn miễn phí qua số 0947407203 hoặc gặp Phạm Anh Tiến . Thu gọn Liên hệ: SĐT 1 094 740 **** Hiện số",,,,,,,
306284175,15,Giảm Sốc 1.6 Tỷ - MT Ngô Quyền 4x20m CN 80.6m2 - 4 Tầng - HĐT 50 Tr/tháng - bán 31.4 tỷ,"31,4 tỷ",31.4,giảm sốc 1.6 tỷ - mt ngô quyền 4x20m cn 80.6m2 - 4 tầng - hđt 50 tr/tháng - bán 31.4 tỷ,80.6,N/A,"Đ. Ngô Quyền, P. 8, Q. 5, Tp. Hồ Chí Minh",,,25/12/2025,https://meeyland.com/ban-nha-rieng-quan-5-ho-chi-minh-i1223/306284175,"Chủ cần chủ cần xử lý việc cá nhân gấp, chấp nhận giảm tổng cộng 1.6 Tỷ (tương đương 5%) trên giá 33 Tỷ cho khách thiện chí giao dịch nhanh. Vị trí Độc Tôn: Nhà Mặt tiền đường Ngô Quyền, Phường 8, Quận 5. Vị trí đẹp ngay gần căn góc, kế ngã tư Mạc Thiên Tích. Quy mô: Diện tích 4.05m x 20m. Công nhận 80.6m². Kết cấu: 4 Tầng. Dòng tiền ổn định: Hợp đồng thuê 50 Triệu/tháng. Giá Bán Nhanh: 31.4 Tỷ VNĐ (Giá chốt cuối). Liên hệ: SĐT 1 090 348 **** Hiện số Thông tin chi tiết Mặt tiền 4,05m Ưu điểm BĐS Căn góc","4,05m",,,Căn góc,,,
306285567,15,Bán căn hộ 77.6m² chung cư Lê Hồng Phong đường Phan Văn Trị Phường 2 Quận 5 TP Hồ Chí Minh,"3,55 tỷ",3.55,"45,75 triệu/m²",77.6,N/A,"Đ. Phan Văn Trị, P. 2, Q. 5, Tp. Hồ Chí Minh",2,2,25/12/2025,https://meeyland.com/ban-can-ho-chung-cu-quan-5-ho-chi-minh-i1423/306285567,"Bán căn hộ 77.6m² chung cư Lê Hồng Phong đường Phan Văn Trị Phường 2 Quận 5 TP Hồ Chí Minh. - Chung cư 5 tầng, thang bộ, nhà tầng 3, 1 sàn 2 căn, lệch tầng. - Diện tích: 77,6m², 2 phòng ngủ, phòng khách, phòng bếp riêng, 2 ban công, 1WC, nhà đầy đủ nội thất vào ở ngay. Nhà đẹp view thoáng. - Vị trí: Ngay ngã 3 Phan Văn Trị - Lê Hồng Phong khu vực trung tâm Quận 5 đầy đủ các tiện ích liền kề. - Pháp lý: Sổ hồng công chứng. - Giá bán: 3,55 tỷ. Lh: 0913209636 Liên hệ: SĐT 1 091 320 **** Hiện số Thông tin chi tiết Ưu điểm BĐS Phân lô liền kề",,,,Phân lô liền kề,,,
306285006,15,"Góc 2MT Trần Hưng Đạo + Huỳnh Mẫn Đạt, Quận 5 - 5x20m - Hầm 5 Tầng - HĐT 150 triệu - Giá 75 tỷ",75 tỷ,75.0,750 triệu/m²,100,N/A,"P. 5, Q. 5, Tp. Hồ Chí Minh",,,25/12/2025,https://meeyland.com/ban-nha-rieng-quan-5-ho-chi-minh-i1223/306285006,"Góc 2 mặt tiền Trần Hưng Đạo & Huỳnh Mẫn Đạt, Quận 5 - Diện tích: 5 x 20m. - Xây dựng: Hầm 5 tầng. - HĐ thuê 150 triệu/tháng. - Vị trí siêu đẹp ngay lõi trung tâm Quận 1 - cách Chợ Bến Thành 200m. - Giá 75 tỷ. - Liên hệ: 0903899991 - Quỳnh Anh. Liên hệ: SĐT 1 090 389 **** Hiện số Thông tin chi tiết Mặt tiền 5m",5m,,,,,,
306284944,15,"Bán chung cư Quận 5, Hồ Chí Minh giá rẻ (1/2026)",N/A,,N/A,,N/A,Căn hộ chung cư,,,N/A,https://meeyland.com/ban-can-ho-chung-cu-quan-5-ho-chi-minh-i1423/306284944,N/A,,,,,,,
306282936,15,"Katinat thuê 250 triệu/tháng góc 3MT Châu Văn Liêm 9x12m kết cấu 7 tầng kiên cố, chủ cần bán gấp",N/A,,N/A,121.2,N/A,"Đ. Châu Văn Liêm, P. 13, Q. 5, Tp. Hồ Chí Minh",,,25/12/2025,https://meeyland.com/ban-nha-rieng-quan-5-ho-chi-minh-i1223/306282936,"Góc 3 mặt tiền Châu Văn Liêm dòng tiền khủng vị trí đắc địa bậc nhất Quận 5. - Diện tích: 9 X 12m. 121.2m2. - Kết cấu: 7 tầng kiên cố, thiết kế hiện đại, đang khai thác ổn định. - Hiện trạng khai thác: Katinat thuê 250 triệu/tháng thương hiệu lưu lượng khách lớn, tạo dòng tiền đều đặn và bền vững. - Hiện trạng chủ nhà: Cần bán giải quyết nợ thiện chí, thương lượng tốt cho khách thiện ý. - Pháp lý: Sổ hồng rõ ràng, công chứng nhanh gọn. - Vị trí: Nằm ở góc 3 mặt tiền vô cùng hiếm, tầm nhìn thoáng trọn vẹn, khu kinh doanh sầm uất bậc nhất quận 5 phù hợp mở chuỗi f&b, thời trang hoặc giữ dòng tiền cho thuê cực tốt. Em là Thanh Hoài chuyên viên tư vấn đầu tư bất động sản nhà phố trung tâm. Mang lại sản phẩm thật & giá trị thật cho khách hàng. Tư vấn tận tình trung thực và uy tín. Chỉ đăng tin thật không cố tình đăng sai thông tin sự thật để mất thời gian của Khách Hàng. Liên Hệ ngay với em qua SDT/Zalo: 0937699221 Thu gọn Liên hệ: SĐT 1 093 769 **** Hiện số Thông tin chi tiết Mặt tiền 9m Hướng ban công Đông Bắc",9m,,,,,Đông Bắc,
306284170,15,"Bán Nhà Trần Hưng Đạo, Trung Tâm Quận 5, nở hậu, hẻm thông sát mặt tiền, chỉ 6 tỷ TL",6 tỷ,6.0,125 triệu/m²,48,N/A,"P. 5, Q. 5, Tp. Hồ Chí Minh",2,2,25/12/2025,https://meeyland.com/ban-nha-rieng-quan-5-ho-chi-minh-i1223/306284170,"+ Nhà BTCT thiết kế chắc chắn, 2PN rộng, 2WC, mát rượi cả ngày, Chủ nhà đã hỏi sẵn có thể xây thêm 1 tầng., + Hẻm ba gác thông tứ tung, vị trí đắc địa Quận Trung Tâm., + Sổ nở hậu, pháp lý chuẩn, công chứng trong ngày., + Khu vực dân trí cao, nhiều tiện ích bán kính 1km xung quanh không thiếu thứ gì. Liên hệ: SĐT 1 090 461 **** Hiện số Thông tin chi tiết Ưu điểm BĐS Dân trí cao, Gần nhiều tiện ích, Đất vuông - nở hậu",,,,"Dân trí cao, Gần nhiều tiện ích, Đất vuông - nở hậu",,,
306283365,15,"Căn hộ cao cấp quận 5. Duplex 185m2. 12tỷ nhận nhà. Sổ hồng riêng. Giá từ chủ đầu tư nhà, mới 100%",N/A,,N/A,185,N/A,"P. 1, Q. 5, Tp. Hồ Chí Minh",,,25/12/2025,https://meeyland.com/ban-can-ho-chung-cu-quan-5-ho-chi-minh-i1423/306283365,"Căn hộ cao cấp duy nhất còn sót tại trung tâm Thành Phố. Căn Duplex duy nhất, căn góc, view ôm trọn trung tâm có thể ngắm pháo hoa. - Vị trí ngay quận 5, mặt tiền đường Trần Hưng Đạo. - 2 phút là đến quận 1. - Tiện ích nội khu chuẩn 5 sao. - Tiện ích ngoại khu thì không phải bàn vì cần gì cũng có. - Chỉ trả trước với 12 tỷ nhận nhà ở ngay. - Sổ hồng riêng từng căn. - Pháp lý đầy đủ. Liên hệ: SĐT 1 094 688 **** Hiện số Thông tin chi tiết Ưu điểm BĐS Căn góc",,,,Căn góc,,,
306280131,15,"Bán Nhà Trung Tâm Quận 5 Cao Đạt Giá 5,88 Tỷ - nhà mới dọn vào ở ngay. 0949757339","5,89 tỷ",5.89,"218,15 triệu/m²",27,N/A,"Đ. Cao Đạt, P. 1, Q. 5, Tp. Hồ Chí Minh",2,2,25/12/2025,https://meeyland.com/ban-nha-rieng-quan-5-ho-chi-minh-i1223/306280131,"Địa chỉ: Đường Cao Đạt, Quận 5, TP. HCM. Giá bán: 5,88 tỷ (thương lượng). Diện tích: 3m x 9m. Diện tích sử dụng: ~60m. Kết cấu: 1 trệt + 2 lầu. Phòng ngủ: 2. WC: 2. Có ban công, nhà thoáng mát. Nhà đẹp, sạch sẽ, full nội thất, chỉ việc xách vali vào ở ngay. Vị trí cực đẹp: Gần Trần Hưng Đạo, Trần Bình Trọng, Võ Văn Kiệt. Kết nối nhanh Quận 1, Quận 10, Quận 3. Khu dân cư an ninh, tiện ích đầy đủ. Pháp lý: Sổ hồng riêng, hoàn công đầy đủ, công chứng nhanh. Liên hệ: Hồng thanh. Hỗ trợ xem nhà thương lượng chính chủ. Thu gọn Liên hệ: SĐT 1 094 975 **** Hiện số Thông tin chi tiết Mặt tiền 3m",3m,,,,,,
306282612,15,Cc Mặt tiền có gác Trần Hưng Đạo Quận 5 75m2 2PN giá rẻ sổ hồng riêng,"2,3 tỷ",2.3,"30,67 triệu/m²",75,N/A,"P. 14, Q. 5, Tp. Hồ Chí Minh",5,2,25/12/2025,https://meeyland.com/ban-can-ho-chung-cu-quan-5-ho-chi-minh-i1423/306282612,"Bán nhà cc có gác Trần Hưng Đạo quận 5. Lô góc thoáng mát sơn nhẹ vào ở ngay. Vị trí gần Quận 10, Đh y dược sát bên quận 1. An ninh dân trí gần trường học các cấp. Liên hệ: SĐT 1 098 424 **** Hiện số Thông tin chi tiết Ưu điểm BĐS Căn góc",,,,Căn góc,,,
306281768,15,Trung tâm Q.5 - Cao Đạt - Nhà 3 tầng DTSD 60m2- Vào Ở ngay - Chỉ 5.88 tỷ,"5,88 tỷ",5.88,280 triệu/m²,21,N/A,"Đ. Cao Đạt, P. 2, Q. 5, Tp. Hồ Chí Minh",2,2,25/12/2025,https://meeyland.com/ban-nha-rieng-quan-5-ho-chi-minh-i1223/306281768,"- DT: 3m x 9m - 21m2 DTSD 60m2. - Kết cấu: 1 trệt 2 lầu 2PN 2WC. - Nhà rất đẹp sạch sẻ có ban công thoáng mát nhà full nội thất kết cấu. Vào ở ngay. - Vị trí: Gần Trần Hưng Đạo, Trần Bình Trọng, Võ Văn Kiệt giáp Q. 1. - Sổ hồng hoàn công đủ, công chứng nhanh. - Gọi ngay 0978150481 gặp Hùng. Liên hệ: SĐT 1 097 815 **** Hiện số Thông tin chi tiết Mặt tiền 3m",3m,,,,,,
306282016,15,"Hàng độc cần bán Nguyễn Tri Phương - P9 - Q5, gần chợ An Đông. 77m2, đạng cho thuê 24 triệu",N/A,,N/A,77,N/A,"Đ. Nguyễn Tri Phương, P. 9, Q. 5, Tp. Hồ Chí Minh",4,4,25/12/2025,https://meeyland.com/ban-nha-rieng-quan-5-ho-chi-minh-i1223/306282016,"Hàng độc cần bán Nguyễn Tri Phương - Phường 9 - Quận 5, gần chợ An Đông, sẵn dòng tiền cho thuê 24 triệu / tháng. - Diện tích: 4,6m x 16,7m (77m2). - Kết cấu: 1 trệt - 2 lầu - đúc bê tông cốt thép kiên cố. - Gồm: 4 phòng ngủ - 5 nhà vệ sinh. * Liên hệ: 0948493459) gặp em Phát để được hỗ trợ miễn phí. Liên hệ: SĐT 1 094 849 **** Hiện số Thông tin chi tiết Mặt tiền 4,6m","4,6m",,,,,,
306279784,15,"Bán nhà mặt phố Trần Phú quận 5, 300 triệu/m2, 142m2, hàng hiếm tại giá cực chất",44 tỷ,44.0,"bán nhà mặt phố trần phú quận 5, 300 triệu/m2, 142m2, hàng hiếm tại giá cực chất",142,N/A,"P. 8, Q. 5, Tp. Hồ Chí Minh",4,4,25/12/2025,https://meeyland.com/ban-nha-rieng-quan-5-ho-chi-minh-i1223/306279784,"Nhà mặt phố Trần Phú, Phường 8, Quận 5, Hồ Chí Minh với diện tích 142m2, 3 tầng, 4PN, 3WC, pháp lý đầy đủ. Đường lớn rộng 20m chia 2 bên ngược chiều nhau di chuyển thông suốt đi từ đầu đường Nguyễn Tri Phương chạy 1 mạch lên tới vòng xoay ngã 7. Vị trí cực kì đắc địa, xung quanh đa số chủ nhà cho công ty, ngân hàng, hãng xe thuê để hoạt động dòng tiền từ 50 triệu - 100 triệu/tháng Mặt tiền 5.8m, dài 19m. Nhà có 3 tầng rộng to bề thế, lý tưởng cho vừa ở vừa kinh doanh. Nội thất đầy đủ với điều hòa, tủ lạnh, giường... có đầy đủ. Gần trung tâm tiếng Trung Hoa Văn Thương Mại, bệnh viện Chợ Rẫy, công viên Hòa Bình, và siêu thị Satramart. Liên hệ ngay Thảo_Phúc Điền qua số 0934061609 để biết thêm chi tiết. Thu gọn Liên hệ: SĐT 1 093 406 **** Hiện số Thông tin chi tiết Mặt tiền 5,8m","5,8m",,,,,,
306279426,15,Hạ giá 39 Tỷ - Bán nhà mặt tiền (2 chiều) Trần Phú Q.5 (MH 10 x 20m) XD Hầm 7 Tầng - HĐT 200 tr/th,39 tỷ,39.0,325 triệu/m²,120,N/A,"P. 8, Q. 5, Tp. Hồ Chí Minh",,,25/12/2025,https://meeyland.com/ban-nha-rieng-quan-5-ho-chi-minh-i1223/306279426,"Hạ giá 39 Tỷ - Cần bán gấp nhà mặt tiền (đoạn 2 chiều) Trần Phú, Phường 8, Quận 5 - Diện tích : MH 10 x 20m - Xây dựng : Hầm 7 Tầng - Hợp đồng thuê : 200 triệu/tháng - Siêu vị trí - góc 2 mặt tiền tuyến đường thương hiệu - Giá bán : 39 Tỷ LIÊN HỆ : 0901386118 KHỞI KIỆT Liên hệ: SĐT 1 090 138 **** Hiện số",,,,,,,
306281503,15,"Bán gấp nhà 3 tầng Btct, trung tâm quận 5 Cao Đạt, Nguyễn Biểu","5,78 tỷ",5.78,"214,07 triệu/m²",27,N/A,"Đ. Cao Đạt, P. 1, Q. 5, Tp. Hồ Chí Minh",,,25/12/2025,https://meeyland.com/ban-nha-rieng-quan-5-ho-chi-minh-i1223/306281503,"Cần bán nhà trước tết ngay trung tâm Q5 Vị trí: Cao Đạt, Nguyễn Biểu, Trần Bình Trọng, Nguyễn Văn Cừ di chuyển thuận thiện các tuyến đường Kết cấu: 1 trệt 2 lầu, có ban công thoáng mát. Hẻm sạch sẽ, thông, gần 4m Sổ hoàn công đầy đủ, công chứng nhanh Giá: 5.78 Lh: 0888 164 167 Hà để dc xem nhà và nhiều căn tương tự Liên hệ: SĐT 1 088 816 **** Hiện số",,,,,,,
306281427,15,Nhà Cao Đạt Quận 5- Hẻm xe hơi- Cách 2 căn ra mặt tiền- 6.5 tỷ,"6,5 tỷ",6.5,"162,5 triệu/m²",40,N/A,"Đ. Cao Đạt, P. 2, Q. 5, Tp. Hồ Chí Minh",,,25/12/2025,https://meeyland.com/ban-nha-rieng-quan-5-ho-chi-minh-i1223/306281427,"Bán nhà hẻm xe hơi Cao Đạt, Phường 2, Quận 5 vị trí hiếm, hẻm thẳng đẹp, kinh doanh đỉnh, đã kiểm tra quy hoạch toàn bộ trên địa chính, cực hiếm vip Thông tin chi tiết: Diện tích: 48m² (ngang 3m x dài 16m). DTSD đúng 40m2 Hiện trạng: nhà cấp 4 xác định mua đất xây lại Hẻm: xe hơi vào tận cửa, hẻm thẳng 1 trục, cách mặt tiền chỉ 2 căn nhà Ưu điểm nổi bật: Vị trí đắc địa Quận 5, khu dân cư hiện hữu, an ninh Hẻm xe hơi thẳng hiếm, dễ xây dựng, dễ thanh khoản Sổ chính chủ lâu năm, chưa qua mua bán Giá bán: 6.5 tỷ (còn thương lượng) Thu gọn Liên hệ: SĐT 1 093 756 **** Hiện số Thông tin chi tiết Mặt tiền 3m Hướng ban công Tây",3m,,,,,Tây,
306279603,15,"Chdv cao cấp hầm + 7 tầng - thang máy - trung tâm sầm uất q.5, sát quận 1 - 108m2- 38 tỷ",38 tỷ,38.0,"351,85 triệu/m²",108,N/A,"Đ. Nguyễn Trãi, P. 3, Q. 5, Tp. Hồ Chí Minh",,,25/12/2025,https://meeyland.com/ban-nha-rieng-quan-5-ho-chi-minh-i1223/306279603,"CHDV CAO CẤP HẦM + 7 TẦNG - THANG MÁY - TRUNG TÂM SẦM UẤT Q.5, SÁT QUẬN 1 - 108M2- 38 TỶ Hầm + 6 tầng + sân thượng Thang máy, thang thoát hiểm, PCCC đầy đủ Hầm để xe riêng, 1 mặt bằng kinh doanh 30 phòng CHDV khai thác kín Trang bị máy nước nóng năng lượng mặt trời Thu nhập thực tế ~130 triệu/tháng, Liên hệ: SĐT 1 093 748 **** Hiện số Thông tin chi tiết Tiện ích Thang máy",,,,,,,Thang máy
306276873,15,"Siêu phẩm ngộp bank góc 2 MT 2 chiều Trần Phú,Q.5 ( 10 x 21m) CN:150m2 2 Tầng Giá chỉ 40 tỷ",40 tỷ,40.0,"266,67 triệu/m²",150,N/A,"P. 8, Q. 5, Tp. Hồ Chí Minh",,,25/12/2025,https://meeyland.com/ban-nha-rieng-quan-5-ho-chi-minh-i1223/306276873,"Bán Nhà Góc 2 Mặt Tiền đoạn 2 chiều Trần Phú. Phường 8. Quận 5 - Diện tích: 5,8 x 19,3m. NH: 10m - Công nhận: 150 m2 - Kết cấu: 2 Tầng - Giá: 44 Tỷ về Chốt 40 Tỷ Liên hệ: SĐT 1 093 302 **** Hiện số",,,,,,,
306278169,15,Bán nhà 2 mặt tiền Nguyễn Trãi - DT: 15 x 45m - CTXD: Hầm + 10 tầng - giá bán: 115 tỷ TL,115 tỷ,115.0,"145,57 triệu/m²",790,N/A,"P. 5, Q. 5, Tp. Hồ Chí Minh",,,25/12/2025,https://meeyland.com/ban-nha-rieng-quan-5-ho-chi-minh-i1223/306278169,"- Bán nhà 2 mặt tiền Hùng Vương, P. 9, Quận 5. - Diện tích: 15 x 45m. Công nhận: 700m². - Hiện trạng: Nhà cấp 4. - Khu vực xây dựng: Hầm + 10 tầng. - Giá bán: 115 tỷ TL. LH 0917922503 Sơn Nguyễn Xem nhà làm việc chính chủ Liên hệ: SĐT 1 091 792 **** Hiện số",,,,,,,
306279730,15,"Bán nhà mặt tiền Trần Hưng Đạo, Q5, thang máy, hợp đồng thuê 45tr/tháng",29 tỷ,29.0,"491,53 triệu/m²",59,N/A,"P. 11, Q. 5, Tp. Hồ Chí Minh",,,25/12/2025,https://meeyland.com/ban-nha-rieng-quan-5-ho-chi-minh-i1223/306279730,"Bán nhà mặt tiền Trần Hưng Đạo(P. 11, Q. 5 cũ), Phường Chợ Lớn, TP. HCM mặt tiền trung tâm, thang máy, hợp đồng thuê ổn định, giá tốt. Tọa lạc ngay mặt tiền đường Trần Hưng Đạo, một trong những tuyến đường huyết mạch kết nối Quận 1 Quận 5 Quận 10. - Khu vực tập trung nhiều ngân hàng, showroom, nhà hàng, khách sạn và tòa nhà văn phòng, mang lại giá trị kinh doanh và cho thuê cực cao. Diện tích: 4,4m x 12,3m (nở hậu 5,25m) = 59 m². Kết cấu: Trệt + 4 lầu + sân thượng, có thang máy hiện đại. Hợp đồng thuê: 45 triệu/tháng, gia hạn hàng năm, có thể lấy lại nhà khi cần. Giá bán: 29 tỷ ~ 491,5 triệu/m². Xem thêm: Https://proviewland.vn/nha-pho-ban/ Liên Hệ: 0919942121 0919942121 Mr Hiền (Viber/Zalo/whatsapp). Thu gọn Liên hệ: SĐT 1 091 994 **** Hiện số Thông tin chi tiết Mặt tiền 4,4m Tiện ích Thang máy Ưu điểm BĐS Đất vuông - nở hậu","4,4m",,,Đất vuông - nở hậu,,,Thang máy
